autor,titlu,text
Mihai Eminescu,Împărat și proletar,"Pe bănci de lemn, în scunda tavernă mohorâtă,
Unde pătrunde ziua printre ferești murdare,
Pe lângă mese lunge, stătea posomorâtă,
Cu fețe-ntunecoase, o ceată pribegită,
Copii săraci și sceptici ai plebei proletare.

Ah! - zise unul - spuneți că-i omul o lumină
Pe lumea asta plină de-amaruri și de chin?
Nici o scânteie-ntr-însul nu-i candidă și plină,
Murdară este raza-i ca globul cel de tină,
Asupra cărui dânsul domnește pe deplin.

Spuneți-mi ce-i dreptatea? - Ce-i tari se îngrădiră
Cu-averea și mărirea în cercul lor de legi;
Prin bunuri ce furară, în veci vezi cum conspiră
Contra celor ce dânșii la lucru-i osândiră
Și le subjugă munca vieții lor întregi.

Unii plini de plăcere petrec a lor viață,
Trec zilele voioase și orele surâd.
În cupe vin de ambră - iarna grădini, verdeață,
Vara petreceri, Alpii cu frunțile de gheață -
Ei fac din noapte ziuă ș-a zilei ochi închid.

Virtutea pentru dânșii - ea nu există. Însă
V-o predică, căci trebuie să fie brațe tari,
A statelor greoaie cară trebuie-mpinse
Și trebuiesc luptate războaiele aprinse,
Căci voi murind în sânge, ei pot să fie mari.

Și flotele puternice ș-armatele făloase,
Coroanele ce regii le pun pe fruntea lor,
Ș-acele milioane, ce în grămezi luxoase
Sunt strânse la bogatul, pe cel sărac apasă,
Și-s supte din sudoarea prostitului popor.

Religia - o frază de dânșii inventată
Ca cu a ei putere să vă aplece-n jug,
Căci de-ar lipsi din inimi speranța de răsplată,
După ce-amar muncirăți mizeri viața toată,
Ați mai purta osânda ca vita de la plug?

Cu umbre, care nu sunt, v-a-ntunecat vederea
Și v-a făcut să credeți că veți fi răsplătiți...
Nu! moartea cu viața a stins toată plăcerea -
Cel ce în astă lume a dus numai durerea
Nimic n-are dincolo, căci morți sunt cei muriți.

Minciuni și fraze-i totul ce statele susține,
Nu-i ordinea firească ce ei a fi susțin;
Averea să le aperi, mărirea ș-a lor bine,
Ei brațul tău înarmă ca să lovești în tine,
Și pe voi contra voastră la luptă ei vă mân.

De ce să fiți voi sclavii milioanelor nefaste,
Voi, ce din munca voastră abia puteți trăi?
De ce boala și moartea să fie partea voastră,
Când ei în bogăția cea splendidă și vastă
Petrec ca și în ceruri, n-au timp nici de-a muri?

De ce uitați că-n voi e și număr și putere?
Când vreți, puteți prea lesne pământul să-mpărțiți.
Nu le mai faceți ziduri unde să-nchid-avere,
Pe voi unde să-nchidă, când împinși de durere
Veți crede c-aveți dreptul și voi ca să trăiți.

Ei îngrădiți de lege, plăcerilor se lasă,
Și sucul cel mai dulce pământului i-l sug;
Ei cheamă-n voluptatea orgiei zgomotoase
De instrumente oarbe a voastre fiici frumoase:
Frumsețile-ne tineri bătrânii lor distrug.

Și de-ntrebați atuncea, vouă ce vă rămâne?
Munca, din care dânșii se-mbată în plăceri,
Robia viața toată, lacrimi pe-o neagră pâne,
Copilelor pătate mizeria-n rușine...
Ei tot și voi nimica; ei cerul, voi dureri!

De lege n-au nevoie - virtutea e ușoară
Când ai ce-ți trebuiește... Iar legi sunt pentru voi,
Vouă vă pune lege, pedepse vă măsoară
Când mâna v-o întindeți la bunuri zâmbitoare,
Căci nu-i iertat nici brațul teribilei nevoi.

Zdrobiți orânduiala cea crudă și nedreaptă,
Ce lumea o împarte în mizeri și bogați!
Atunci când după moarte răsplată nu v-așteaptă,
Faceți ca-n astă lume să aibă parte dreaptă,
Egală fiecare, și să trăim ca frați!

Sfărmați statuia goală a Venerei antice,
Ardeți acele pânze cu corpuri de ninsori;
Ele stârnesc în suflet ideea neferice
A perfecției umane și ele fac să pice
În ghearele uzurei copile din popor!

Sfărmați tot ce ațâță inima lor bolnavă,
Sfărmați palate, temple, ce crimele ascund,
Zvârliți statui de tirani în foc, să curgă lavă,
Să spele de pe pietre până și urma sclavă
Celor ce le urmează pân' la al lumii fund!

Sfărmați tot ce arată mândrie și avere,
O! dezbrăcați viața de haina-i de granit,
De purpură, de aur, de lacrimi, de urât -
Să fie un vis numai, să fie o părere,
Ce făr' de patimi trece în timpul nesfârșit.

Zidiți din dărmăture gigantici piramide
Ca un memento mori pe al istoriei plan;
Aceasta este arta ce sufletu-ți deschide
Naintea veciniciei, nu corpul gol ce râde
Cu mutra de vândută, cu ochi vil și viclean.

O! aduceți potopul, destul voi așteptarăți
Ca să vedeți ce bine prin bine o să ias';
Nimic... Locul hienei îl luă cel vorbăreț,
Locul cruzimii vechie, cel lins și pizmătareț.
Formele se schimbară, dar răul a rămas.

Atunci vă veți întoarce la vremile-aurite,
Ce mitele albastre ni le șoptesc ades,
Plăcerile egale, egal vor fi-mpărțite,
Chiar moartea când va stinge lampa vieții finite
Vi s-a părea un înger cu părul blond și des.

Atunci veți muri lesne fără de-amar și grijă,
Feciorii-or trăi-n lume cum voi ați viețuit,
Chiar clopotul n-a plânge cu limba lui de spijă
Pentru acel de care norocul avu grijă;
Nimeni de-a plânge n-are, el traiul și-a trăit.

Și boale ce mizeria ș-averea nefirească
Le nasc în oameni, toate cu-ncetul s-or topi;
Va crește tot ce-n lume este menit să crească,
Va bea pân-în fund cupa, pân' va vrea s-o zdrobească,
Căci va muri când nu va avea la ce trăi.

Pe malurile Seinei, în faeton de gală,
Cezarul trece palid, în gânduri adâncit;
Al undelor greu vuiet, vuirea în granit
A sute d-echipajuri, gândirea-i n-o înșală;
Poporul loc îi face tăcut și umilit.

Zâmbirea lui deșteaptă, adâncă și tăcută,
Privirea-i ce citește în suflete-omenești,
Și mâna-i care poartă destinele lumești,
Cea grupă zdrențuită în cale-i o salută.
Mărirea-i e în taină legată de acești.

Convins ca voi el este-n nălțimea-i solitară
Lipsită de iubire, cum că principiul rău,
Nedreptul și minciuna al lumii duce frâu;
Istoria umană în veci se desfășoară,
Povestea-i a ciocanului ce cade pe ilău.

Și el - el vârful mândru al celor ce apasă -
Salută-n a lui cale pe-apărătorul mut.
De ați lipsi din lume, voi cauza-ntunecoasă
De răsturnări mărețe, mărirea-i radioasă,
Cezarul, chiar Cezarul de mult ar fi căzut.

Cu ale voastre umbre nimica crezătoare,
Cu zâmbetu-vă rece, de milă părăsit,
Cu mintea de dreptate și bine râzătoare,
Cu umbra voastră numai, puteri îngrozitoare,
La jugu-i el silește pe cei ce l-au urât.

Parisul arde-n valuri, furtuna-n el se scaldă,
Turnuri ca facle negre trăsnesc arzând în vânt -
Prin limbile de flacări, ce-n valuri se frământ,
Răcnete, vuiet de-arme pătrund marea cea caldă,
Evul e un cadavru - Paris al lui mormânt.

Pe stradele-ncrușite de flacări orbitoare,
Suiți pe baricade de bulgări de granit,
Se mișc batalioane a plebei proletare,
Cu cușme frigiene și arme lucitoare,
Și clopote de-alarmă răsună răgușit.

Ca marmura de albe, ca ea nepăsătoare,
Prin aerul cel roșu, femei trec cu-arme-n braț,
Cu păr bogat și negru ce pe-umeri se coboară
Și sânii lor acopăr - e ură și turbare
În ochii lor cei negri, adânci și desperați.

O! luptă-te-nvălită în pletele-ți bogate,
Eroic este astăzi copilul cel pierdut!
Căci flamura cea roșă cu umbra-i de dreptate
Sfințește-a ta viață de tină și păcate;
Nu! nu ești tu de vină, ci cei ce te-au vândut!

Scânteie marea lină, și placele ei sure
Se mișc-una pe alta ca pături de cristal
Prin lunce prăvălite; din tainica pădure
Apare luna mare câmpiilor azure,
Împlându-le cu ochiul ei mândru, triumfal.

Pe undele încete își mișcă legănate
Corăbii învechite scheletele de lemn;
Trecând încet ca umbre - țin pânzele umflate
În fața lunei, care prin ele-atunci străbate,
Și-n roată de foc galben stă fața-i ca un semn.

Pe maluri zdrumicate de aiurirea mării
Cezaru-ncă veghează la trunchiul cel plecat
Al salciei pletoase - și-ntinse-a apei arii
În cercuri fulgerânde se pleacă lin suflării
A zefirului nopții și sună cadențat.

Îi pare că prin aer în noapte înstelată,
Călcând pe vârf de codri, pe-a apelor măriri,
Trecea cu barba albă - pe fruntea-ntunecată
Cununa cea de paie îi atârna uscată -
Moșneagul rege Lear.

Uimit privea cezarul la umbra cea din nouri,
Prin creți ai cărei stele lin tremurând transpar,
I se deschide-n minte tot sensul din tablouri
A vieții sclipitoare... A popoarelor ecouri
Par glasuri ce îmbracă o lume de amar:

""În orice om o lume își face încercarea,
Bătrânul Demiurgos se opintește-n van;
În orice minte lumea își pune întrebarea
Din nou: de unde vine și unde merge floarea
Dorințelor obscure sădite în noian.

Al lumii-ntregul sâmbur, dorința-i și mărirea,
În inima oricărui i-ascuns și trăitor,
Zvârlire hazardată, cum pomu-n înflorire
În orice floare-ncearcă întreagă a sa fire,
Ci-n calea de-a da roade cele mai multe mor.

Astfel umana roadă în calea ei îngheață,
Se petrifică unul în sclav, altu-mpărat,
Acoperind cu noime sărmana lui viață
Și arătând la soare-a mizeriei lui față -
Fața - căci înțelesul e-același la toți dat.

În veci aceleași doruri mascate cu-altă haină,
Și-n toată omenirea în veci același om -
În multe forme-apare a vieții crudă taină,
Pe toți ea îi înșală, la nime se distaină,
Dorinți nemărginite plăntând într-un atom.

Când știi că visu-acesta cu moartea se sfârșește,
Că-n urmă-ți rămân toate astfel cum sunt, de dregi
Oricât ai drege-n lume - atunci te obosește
Eterna alergare... ș-un gând te-ademenește:
Că vis al morții-eterne e viața lumii-ntregi."""
Mihai Eminescu,Pe lângă plopii fără soț...,"Pe lângă plopii fără soț
Adesea am trecut;
Mă cunoșteau vecinii toți -
Tu nu m-ai cunoscut.

La geamul tău ce strălucea
Privii atât de des;
O lume toată-nțelegea -
Tu nu m-ai înțeles.

De câte ori am așteptat
O șoaptă de răspuns!
O zi din viață să-mi fi dat,
O zi mi-era de-ajuns;

O oră să fi fost amici,
Să ne iubim cu dor,
S-ascult de glasul gurii mici
O oră, și să mor.

Dându-mi din ochiul tău senin
O rază dinadins,
În calea timpilor ce vin
O stea s-ar fi aprins;

Ai fi trăit în veci de veci
Și rânduri de vieți,
Cu ale tale brațe reci
Înmărmureai măreț,

Un chip de-a pururi adorat
Cum nu mai au perechi
Acele zâne ce străbat
Din timpurile vechi.

Căci te iubeam cu ochi păgâni
Și plini de suferinți,
Ce mi-i lăsară din bătrâni
Părinții din părinți.

Azi nici măcar îmi pare rău
Că trec cu mult mai rar,
Că cu tristeță capul tău
Se-ntoarce în zadar,

Căci azi le semeni tuturor
La umblet și la port,
Și te privesc nepăsător
C-un rece ochi de mort.

Tu trebuia să te cuprinzi
De acel farmec sfânt,
Și noaptea candelă s-aprinzi
Iubirii pe pământ."
Mihai Eminescu,Glossă,"Vreme trece, vreme vine,
Toate-s vechi și nouă toate;
Ce e rău și ce e bine
Tu te-ntreabă și socoate;
Nu spera și nu ai teamă,
Ce e val ca valul trece;
De te-ndeamnă, de te cheamă,
Tu rămâi la toate rece.

Multe trec pe dinainte,
În auz ne sună multe,
Cine ține toate minte
Și ar sta să le asculte?...
Tu așează-te deoparte,
Regăsindu-te pe tine,
Când cu zgomote deșarte
Vreme trece, vreme vine.

Nici încline a ei limbă
Recea cumpăn-a gândirii
Înspre clipa ce se schimbă
Pentru masca fericirii,
Ce din moartea ei se naște
Și o clipă ține poate;
Pentru cine o cunoaște
Toate-s vechi și nouă toate.

Privitor ca la teatru
Tu în lume să te-nchipui:
Joace unul și pe patru
Totuși tu ghici-vei chipu-i,
Și de plânge, de se ceartă,
Tu în colț petreci în tine
Și-nțelegi din a lor artă
Ce rău și ce e bine.

Viitorul și trecutul
Sunt a filei două fețe,
Vede-n capăt începutul
Cine știe să le-nvețe;
În prezent le-avem pe toate,
Dar de-a lor zădărnicie
Te întreabă și socoate.

Căci acelorași mijloace
Se supun câte există,
Și de mii de ani încoace
Lumea-i veselă și tristă;
Alte măști, aceeași piesă,
Alte guri, aceeași gamă,
Amăgit atât de-adese
Nu spera și nu ai teamă.

Nu spera când vezi mișeii
La izbândă făcând punte,
Te-or întrece nătărăii,
De ai fi cu stea în frunte;
Teamă n-ai, căta-vor iarăși
Între dânșii să se plece,
Nu te prinde lor tovarăș:
Ce e val, ca valul trece.

Ca un cântec de sirenă,
Lumea-ntinde lucii mreje;
Ca să schimbe-actorii-n scenă,
Te momește în vârteje;
Tu pe-alături te strecoară,
Nu băga nici chiar de seamă,
Din cărarea ta afară
De te-ndeamnă, de te cheamă.

De te-ating, să feri în laturi,
De hulesc, să taci din gură;
Ce mai vrei cu-a tale sfaturi,
Dacă știi a lor măsură;
Zică toți ce vor să zică,
Treacă-n lume cine-o trece;
Ca să nu-ndrăgești nimică,
Tu rămâi la toate rece.

Tu rămâi la toate rece,
De te-ndeamnă, de te cheamă;
Ce e val, ca valul trece,
Nu spera și nu ai teamă;
Te întreabă și socoate
Ce e rău și ce e bine;
Toate-s vechi și nouă toate:
Vreme trece, vreme vine."
Mihai Eminescu,S-a dus amorul...,"S-a dus amorul, un amic
Supus amândurora
Deci cânturile mele zic
Adio tuturora.

Uitarea le închide-n scrin
Cu mâna ei cea rece,
Și nici pe buze nu-mi mai vin,
Și nici prin gând mi-or trece.

Atâta murmur de isvor,
Atât senin de stele,
Și un atât de trist amor
Am îngropat în ele!

Din ce noian îndepărtat
Au răsărit în mine!
Cu câte lacrimi le-am udat,
Iubito, pentru tine!

Cum străbăteau atât de greu
Din jalea mea adâncă,
Și cât de mult îmi pare rău
Că nu mai sufăr încă!

Că nu mai vrei să te arați,
Lumină de-ndeparte,
Cu ochii tăi întunecați
Renăscători din moarte!

Și cu acel smerit surâs,
Cu acea blândă față,
Să faci din viața mea un vis,
Din visul meu o viață.

Să mi se pară cum că crești
De cum răsare luna,
În umbra dulcilor povești
Din nopți o mie una.

Era un vis misterios
Și blând din cale-afară,
Și prea era de tot frumos
De-au trebuit să piară.

Prea mult un înger mi-ai părut
Și prea puțin femeie,
Ca fericirea ce-am avut
Să fi putut să steie.

Prea ne pierdusem tu și eu
În al ei farmec poate,
Prea am uitat de Dumnezeu,
Precum uitarăm toate.

Și poate că nici este loc
Pe-o lume de mizerii
Pentr-un atât de sfânt noroc
Străbătător durerii!"
Mihai Eminescu,Departe sunt de tine...,"Departe sunt de tine și singur lângă foc,
Petrec în minte viața-mi lipsită de noroc,
Optzeci de ani îmi pare în lume c-am trăit,
Că sunt bătrân ca iarna, că tu vei fi murit.
Aducerile-aminte pe suflet cad în picuri,
Redeșteptând în față-mi trecutele nimicuri;
Cu degetele-i vântul lovește în ferești,
Se toarce-n gându-mi firul duioaselor povești,
Ș-atuncea dinainte-mi prin ceață parcă treci,
Cu ochii mari în lacrimi, cu mâni subțiri și reci;
Cu brațele-amândouă de gâtul meu te-anini
Ți parc-ai vrea a-mi spune ceva... apoi suspini...
Eu strâng la piept averea-mi de-amor și frumuseți,
În sărutări unim noi sărmanele vieți...
O! glasul amintirii rămâie pururi mut,
Să uit pe veci norocul ce-o clipă l-am avut,
Să uit, cum dup-o clipă din brațele-mi te-ai smult...
Voi fi bătrân și singur, vei fi murit de mult!"
Mihai Eminescu,Freamăt de codru,"Tresărind scânteie lacul
Și se leagănă sub soare;
Eu, privindu-l din pădure,
Las aleanul să mă fure
Și ascult de la răcoare
Pitpalacul.

Din isvoare și din gârle
Apa sună somnoroasă;
Unde soarele pătrunde
Pintre ramuri a ei unde,
Ea în valuri sperioase
Se azvârle.

Cucul cântă, mierle, presuri -
Cine știe să le-asculte?
Ale pasărilor neamuri
Ciripesc pitite-n ramuri
Și vorbesc cu-atât de multe
Înțelesuri.

Cucu-ntreabă: - ""Unde-i sora
Viselor noastre de vară?
Mlădioasă și iubită,
Cu privirea ostenită,
Ca o zână să răsară
Tuturora.""

Teiul vechi un ram întins-a,
Ea să poată să-l îndoaie,
Ramul tânăr vânt să-și deie
Și de brațe-n sus s-o ieie,
Iară florile să ploaie
Peste dânsa.

Se întreabă trist isvorul:
- ""Unde mi-i crăiasa oare?
Părul moale despletindu-și,
Fața-n apa mea privindu-și,
Să m-atingă visătoare
Cu piciorul?""

Am răspuns: - ""Pădure dragă,
Eu nu vine, nu mai vine!
Singuri, voi, stejari, rămâneți
De visați la ochii vineți,
Ce luciră pentru mine
Vara-ntreagă.""

Ce frumos era în crânguri,
Când cu ea m-am prins tovarăș!
O poveste încântată
Care azi e-ntunecată...
De-unde ești, revino iarăși,
Să fim singuri."
Mihai Eminescu,De-or trece anii...,"De-or trece anii cum trecură,
Ea tot mai mult îmi va plăce,
Pentru că-n toat-a ei făptură
E-un ""nu știu cum"" ș-un ""nu știu ce"".

M-a fermecat cu vro scânteie
Din clipa-n care ne văzum?
Deși nu e decât femeie,
E totuși altfel, ""nu știu cum"".

De-aceea una-mi este mie
De ar vorbi, de ar tăce;
Dac-al ei glas e armonie,
E și-n tăcere-i ""nu știu ce"".

Astfel robit de-aceeași jale
Petrec mereu același drum...
În taina farmecelor sale
E-un ""nu știu ce"" ș-un ""nu știu cum""."
Mihai Eminescu,Te duci...,"Te duci și ani de suferință
N-or să te vază ochii-mi triști,
Înamorați de-a ta ființă,
De cum zâmbești, de cum te miști.

Și nu e blând ca o poveste
Amorul meu cel dureros,
Un demon sufletul tău este
Cu chip de marmură frumos.

În față farmecul palorii
Și ochi ce scânteie de vii,
Sunt umezi înfiorătorii
De lingușiri, de viclenii.

Când mă atingi, eu mă cutremur,
Tresar la pasul tău, când treci,
De-al genei tale gingaș tremur
Atârnă viața mea pe veci.

Te duci și rău n-o să-mi mai pară
De-acum de ziua cea de ieri,
Că nu am fost victimă iară
Neînduratelor dureri,

C-auzu-mi n-o să-l mai întuneci
Cu-a gurii dulci suflări fierbinți,
Pe frunte-mi mâna n-o s-o luneci
Ca să mă faci să-mi ies din minți.

Puteam numiri defăimătoare
În gândul meu să-ți iscodesc,
Și te uram cu-nverșunare,
Te blestemam, căci te iubesc.

De-acum nici asta nu-mi rămâne
Și n-o să am ce blestema,
Ca azi va fi ziua de mâne,
Ca mâni toți anii s-or urma -

O toamnă care întârzie
Pe-un istovit și trist isvor;
Deasupra-i frunzele pustie -
A mele visuri care mor.

Viața-mi pare-o nebunie
Sfârșită făr-a fi-nceput,
În toată neagra vecinicie
O clipă-n brațe te-am ținut.

De-atunci, pornind a lui aripe,
S-a dus pe veci norocul meu -
Redă-mi comoara unei clipe
Cu ani de părere de rău!"
Mihai Eminescu,Peste vârfuri,"Peste vârfuri trece lună,
Codru-și bate frunza lin,
Dintre ramuri de arin
Melancolic cornul sună.

Mai departe, mai departe,
Mai încet, tot mai încet,
Sufletu-mi nemângâiet
Îndulcind cu dor de moarte.

De ce taci, când fermecată
Inima-mi spre tine-ntorn?
Mai suna-vei, dulce corn,
Pentru mine vre odată?"
Mihai Eminescu,Somnoroase păsărele...,"Somnoroase păsărele
Pe la cuiburi se adună,
Se ascund în rămurele -
Noapte bună!

Doar isvoarele suspină,
Pe când codrul negru tace;
Dorm și florile-n grădină -
Dormi în pace!

Trece lebăda pe ape
Între trestii să se culce -
Fie-ți îngerii aproape,
Somnul dulce!

Peste-a nopții feerie
Se ridică mândra lună,
Totu-i vis și armonie -
Noapte bună!"
Mihai Eminescu,Revedere,"- ""Codrule, codruțule,
Ce mai faci, drăguțule,
Că de când nu ne-am văzut
Multă vreme au trecut
Și de când m-am depărtat,
Multă lume am îmblat.""

- ""Ia, eu fac ce fac de mult,
Iarna viscolu-l ascult,
Crengile-mi rupându-le,
Apele-astupându-le,
Troienind cărările
Și gonind cântările;
Și mai fac ce fac de mult,
Vara doina mi-o ascult
Pe cărarea spre isvor
Ce le-am dat-o tuturor,
Împlându-și cofeile,
Mi-o cântă femeile.""

- ""Codrule cu râuri line,
Vreme trece, vreme vine,
Tu din tânăr precum ești
Tot mereu întinerești.""

- ""Ce mi-i vremea, când de veacuri
Stele-mi scânteie pe lacuri,
Că de-i vremea rea sau bună,
Vântu-mi bate, frunza-mi sună;
Și de-i vremea bună, rea,
Mie-mi curge Dunărea.
Numai omu-i schimbător,
Pe pământ rătăcitor,
Iar noi locului ne ținem,
Cum am fost, așa rămânem:
Marea și cu râurile,
Lumea cu pustiurile,
Luna și cu soarele.
Codrul cu isvoarele."""
Mihai Eminescu,Când amintirile...,"Când amintirile-n trecut
Încearcă să mă cheme,
Pe drumul lung și cunoscut
Mai trec din vreme-n vreme.

Deasupra casei tale ies
Și azi aceleași stele,
Ce-au luminat atât de des
Înduioșării mele.

Și peste arbori răsfirați
Răsare blânda lună,
Ce ne găsea îmbrățișați
Șoptindu-ne-mpreună.

A noastre inimi își jurau
Credință pe toți vecii,
Când pe cărări se scuturau
De floare liliecii.

Putut-au oare-atâta dor
În noapte să se stingă,
Când valuri de isvor
N-au încetat să plângă,

Cum luna trece prin stejari
Urmând mereu în cale-și
Când ochii tăi, tot încă mari,
Se uită dulci și galeși?"
Mihai Eminescu,Doină,"De la Nistru pân' la Tissa
Tot Românul plânsu-mi-s'a,
Că nu mai poate străbate
De-atâta străinătate.
Din Hotin și pân la Mare
Vin Muscalii de-a călare,
De la Mare la Hotin
Mereu calea ne-o ațin;
Din Boian la Vatra-Dornii
Au umplut omida cornii,
Și străinul te tot paște
De nu te mai poți cunoaște.
Sus la munte, jos pe vale
Și-au făcut dușmanii cale,
Din Satmar pân' în Săcele
Numai vaduri ca acele.
Vai de biet Român săracul!
Îndărăt tot dă ca racul,
Nici îi merge, nici se 'ndeamnă,
Nici îi este toamna, toamnă,
Nici e vara vara lui,
Și-i străin în țara lui.
De la Turnu 'n Dorohoi
Curg dușmanii în puhoi
Și s'așează pe la noi;
Toate cântecele pier,
Sboară păserile toate
De neagra străinatate;
Numai umbra spinului
La ușa creștinului.
Își desbracă țara sinul,
Codrul - frate cu Românul -
De secure se tot pleacă
Și isvoarele îi seacă -
Sărac în țară săracă!

Cine-au îndrăgit străinii,
Mânca-i-ar inima câinii,
Mânca-i-ar casa pustia,
Și neamul nemernicia!

Ștefane Măria Ta,
Tu la Putna nu mai sta,
Las' Archimandritului
Toată grija schitului,
Lasă grija Sfinților
În seama părinților,
Clopotele să le tragă
Ziua 'ntreagă, noaptea 'ntreagă,
Doar s'a 'ndura Dumnezeu,
Ca să 'ți mântui neamul tău!
Tu te 'nalță din mormânt,
Să te aud din corn sunând
Și Moldova adunând.
De-i suna din corn odată,
Ai s'aduni Moldova toată,
De-i suna de două ori,
Îți vin codri 'n ajutor,
De-i suna a treia oară
Toți dușmanii or să piară
Din hotară în hotară -
Îndrăgi-i-ar ciorile
Și spânzurătorile!"
Mihai Eminescu,Mai am un singur dor,"Mai am un singur dor:
În liniștea serii
Să mă lăsați să mor
La marginea mării;
Să-mi fie somnul lin
Și codrul aproape,
Pe-ntinsele ape
Să am un cer senin.
Nu-mi trebuie flamuri,
Nu voi sicriu bogat,
Ci-mi împletiți un pat
Din tinere ramuri.

Și nime-n urma mea
Nu-mi plângă la creștet,
Doar toamna glas să dea
Frunzișului veșted.
Pe când cu zgomot cad
Isvoarele-ntr-una,
Alunece luna
Prin vârfuri lungi de brad.
Pătrunză talanga
Al serii rece vânt,
Deasupră-mi teiul sfânt,
Să-și scuture creanga.

Cum n-oi mai fi pribeag
De-atunci înainte,
M-or troieni cu drag
Aduceri aminte.
Luceferi, ce răsar
Din umbră de cetini,
Fiindu-mi prietini,
O să-mi zâmbească iar.
Va geme de patemi
Al mării aspru cânt...
Ci eu voi fi pământ
În singurătate-mi."
Mihai Eminescu,De-oi adormi,"De-oi adormi curând
În noaptea uitării,
Să mă duceți tăcând
La marginea mării.

Nu voi sicriu bogat,
Făclie și flamuri,
Ci-mi împletiți un pat
Din tinere ramuri.

Să-mi fie somnul lin
Și codrul aproape,
Luceasc-un cer senin
Pe-adâncele ape,

Care-n dureri adânci
Se nalță la maluri,
S-ar atârna de stânci
Cu brațe de valuri,

Se nalță, dar recad
Și murmură-ntr-una,
Când pe păduri de brad
Alunecă luna.

Și nime-n urma mea
Nu-mi plângă la creștet,
Doar moartea glas să dea
Frunzișului veșted.

Să treacă lin prin vânt
Atotștiutoarea,
Deasupră-mi teiul sfânt
Să-și scuture floarea.

Cum n-oi mai fi pribeag
De-atunci înainte,
M-or troieni cu drag
Aduceri aminte,

Ce n-or ști că privesc
O lume de patemi,
Pe când liane cresc
Pe singurătate-mi."
Mihai Eminescu,Nu voi mormânt bogat,"Nu voi mormânt bogat,
Cântare și flamuri,
Ci-mi împletiți un pat
Din tinere ramuri.
Și nime-n urma mea
Nu-mi plângă la creștet,
Frunzișului veșted
Doar vântul glas să-i dea.
În liniștea sării
Să mă-ngropați, pe când
Trec stoluri greu zburând
La marginea mării.

Să-mi fie somnul lin
Și codrul aproape,
Lucească cer senin
Eternelor ape,
Care din văi adânci
Se-nalță la maluri,
Cu brațe de valuri
S-ar atârna de stânci -
Și murmură-ntr-una
Când spumegând recad,
Iar pe păduri de brad
Alunece luna.

Reverse dulci scântei
Atotștiutoarea,
Deasupră-mi crengi de tei
Să-și scuture floarea.
Nemaifiind pribeag
De-atunci înainte,
Aduceri aminte
M-or coperi cu drag
Și stinsele patemi
Le-or troieni căzând,
Uitarea întinzând
Pe singurătate-mi."
Mihai Eminescu,Iar când voi fi pământ,"Iar când voi fi pământ,
În liniștea serii,
Săpați-mi un mormânt
La marginea mării.

Nu voi sicriu bogat,
Podoabe și flamuri,
Ci-mi împletiți un pat
Din veștede ramuri.

Să-mi fie somnul lin
Și codrul aproape,
Să am un cer senin
Pe-adâncile ape.

S-aud cum blânde cad
Isvoarele-ntr-una,
Pe vârfuri lungi de brad
Alunece luna.

S-aud pe valuri vânt,
Din munte talanga,
Deasupra-mi teiul sfânt
Să-și scuture creanga.

Și cum n-oi suferi
De-atuncea-nainte,
Cu flori m-or troieni
Aduceri aminte.

Și cum va înceta
Al inimii zbucium,
Ce dulce-mi va suna
Cântarea de bucium!

Vor arde-n preajma mea
Luminile-n dealuri,
Izbind s-or frământa
Eternele valuri

Și nime-n urma mea
Nu-mi plângă la creștet,
Ci codrul vânt să dea
Frunzișului veșted.

Luceferii de foc
Privi-vor din cetini
Mormânt făr' de noroc
Și fără prieteni."
