autor,titlu,text
George Bacovia,Fanfară,"Ce tristă operă cânta
Fanfara militară
Târziu, în noapte, la grădină...
Și tot orașul întrista
Fanfara militară.

Plângeam și rătăceam pe stradă
În noaptea vastă și senină;
Și-atât de goală era strada-
De-amanți grădina era plină.

Orașul luminat electric
Dădea fiori de nebunie-
Era o noapte de septembrie,
Atât de rece și pustie!

Și tot orașul întrista
Fanfara militară...
Târziu, în noapte, la grădină,
Ce tristă operă cânta
Fanfara militară."
George Bacovia,Gol,"Dă foșnet frunza măruntă,
Umbra e rece-n pădurea sonoră-
O mirare tăcută, poate cruntă,
O amețire de toamnă, de-o horă.

Un haos vrea să mă ducă
De unic uitând și de număr-
Un foșnet uscat mă usucă,
Pe-un arbore plâng ca pe-un umăr.

Și sfârâie-o ploaie ușoară
Pe râpi, pe pădurea uscată-
Caverna de-odinioară...
Și zarea-ntunecată..."
George Bacovia,Nocturnă,"Clar de noapte parfumat,
O grădină cu orizontul depărtat...
Și în somn, pe banca veche, cugetări se contrazic,
Greierul zimțează noaptea, cu nimic.

Cum te-am așteptat...
Totul a trecut-
Luna pare, în oftat,
Un continent cunoscut.

Aici e frumos aranjat
Orice fir;
Veacurile-au stat
Un oraș, pe vale. - Suvenir.

Clar de noapte parfumat,
O grădină cu orizontul depărtat...
Și în somn, pe banca veche, tot mai mic...
Greierul zimțează noaptea, cu nimic..."
George Bacovia,De iarnă,"Cum ninge repede, apoi încet
Și nu știi cât timp mai trebuie de-acum,
E la fereastră, alb-
O fată cu șal negru în cerdacul nins...
Dar prin copaci largi înserează-
Într-un departe nins era tot așa.
În adevăr
Și înnoptate zângăniri,
Apoi va avea loc un bal,
Sau o serbare de spiritism,
Atâtea sunt de făcut...
Când tu apari numai ca amintire.
Cum ninge repede, repede!"
George Bacovia,Umbra,"Mă prăfuise timpul dormind peste hârtii...
Se întindea noianul de unde nu mai vii;
O umbră, în odaie, pe umeri m-apăsa-
Vedeam ce nu se vede, vorbea ce nu era.

- Poți să te culci, e ora și noaptea-ntârziată,
Vei scrie, altă dată, orice și tot nimic.
O umbră ești acuma și pot să te ridic,
Lăsând odaia goală și lampa afumată..."
George Bacovia,De iarnă,"În ecouri bocitoare
Vine iarna, vine-acuși-
Plâng copile pe la uși
Din harmonii cerșitoare.

Plâng fecioare din clavire
Prin palate boierești-
Plâng harmonii la ferești
Milogiri de cimitire.

Răzvrătiții dau ca orbii
Și flămându-l ucigaș-
De la sate la oraș
Au trimis țăranii. - Corbii.

Prin orașele avute
Histerii de muritori,
Pe sub corbii bocitori
Trec femeile pierdute.

Iată, ninge, peste fire, -
Hai la vatră, la povești-
Plâng harmonii la ferești
Milogiri de cimitire."
George Bacovia,Unei fecioare,"Duduia veșnic citește;
Știe clavirul, pictează-
Și nopți de-a rândul veghează
Și poate de-aceea slăbește.

Se crede și unuia spun-
Dar totul rămâne secret-
Duduia visează-un poet,
Bizar, singuratec, nebun."
George Bacovia,Note de toamnă,"În toamna violetă, compozitori celebri
Au aranjat un vast concert...
Pe galbene alei, poeții triști declamă lungi poeme-
E-o toamnă, ca întotdeauna, când totul geme,
Frumos și inert.

Pe străzi elegante, ca o părere,
Femeia modernă a trecut și revine;
Tot haosul e-o veselie de eter.
Și, dacă se zguduie orașul,
Și creierul rămâne pierdut;
Și, dacă munca trosnește din brațe, din piatră, din fier, -
Mulțimea anonimă se va avea în vedere.
Tot, ce-mi trebuie să am, pot să cer.

Parfum... incendiu violet și becurile-aprinse
Amurgul licărește pe-orașul de vitrine-
Pierdut, mă duc și eu, cu brațele învinse,
Plângând,
Și fredonând,
Gândindu-mă la mine."
George Bacovia,Vals de toamnă,"La geamuri, toamna cântă funerar
Un vals îndoliat și monoton...
Prin salon,
După al toamnei bocet mortuar.

Auzi, cum muzica răsună clar
În parcul falnic, antic și solemn, -
Din instrumente jalnice, de lemn,
La geamuri, toamna cântă funerar.

Acum, suspină valsul și mai rar,
O, lasă-mă acum să te cuprind...
- Hai, să valsăm, iubito, hohotind,
După al toamnei bocet mortuar."
George Bacovia,Nocturnă,"O, nu mai cânta, harmonie pribeagă,
Că plâng și nu mai știu unde să mă duc,
În toamna care plânge pe-o veche modestie,
Cu ploaia care curge în mahalaua bleagă,
În noaptea asta-n care am devenit năuc
Oh, plouă și tu gemi cu plâns de armonie...
- Tot altuia, de mine, aminte să-l aduc...
O, nu mai cânta, harmonie pribeagă, -
Că plâng și nu știu unde să mă duc."
George Bacovia,Ninge,"Când iar începe-a ninge
Mă simt de-un dor cuprins.
Mă văd, pe-un drum, departe,
Mergând, încet și nins.

Sub streașină, cerdacul
Se-ntunecă, mâhnit;
Stă rezimată-o fată
De stâlpu-nzăpezit."
George Bacovia,Igienă,"Ea crede c-aș fi atacat...
Și când o sărut se teme,
Dar sclavă plăcerii, ea geme
Și cere un lung sărutat.

Pe urmă, când spasmul a dispărut
Își udă-n parfum o batistă-
O pune pe gură și tristă
Ea șterge un ftizic sărut."
George Bacovia,Și ninge...,"Și ninge în orașul mare
E noaptea plină de orgii,
Iar prin saloane aurii
S-aud orchestre și fanfare.

Femei nocturne, singurele
La colț de stradă se ațin,
Desfrâu de bere și de vin
Prin berării și cafenele.

De orbitoare galantare
De diamant și de rubin...
Și de averi orașu-l plin,
Și ninge în orașul mare!..."
George Bacovia,Plumb de iarnă,"Și iar... aceeași oră de dimineață...
Pe toate mocnind același secret;
Un frig violet și fața e creață-
- O, cum omul a devenit concret...

Lungi plictiseli în turnurile sumbre...
Noian de superstiții, cu hohot sec, târziu;
- Vei merita o lampă-n mohorâte umbre
Și corbii azvârliți de-al nopților pustiu.

În noaptea viforoasă de vei putea învinge
O tristă-ngăduire, sau un humor secret-
Vor auzi în turnuri, se vor uita cum ninge...
- O, cum omul a devenit concret..."
George Bacovia,Nervi de toamnă,"Iarbă de plumb și aer tare...
Pudrat pe-o eczemă ce fața mi-o sapă;
Pe câmp, cu-o umbră de cugetare-
Violet, corbi, și-oglinzi de apă.
- O, tu care vei rătăci ca mine
În culori închise și amețit la pas, -
Dus de frumos, de mai bine...
Demult, într-o toamnă, s-a stins un glas."
George Bacovia,Toamnă,"Clavirele plâng în oraș...

Afară o vreme de plumb
Și vântul împrăștie ploaia,
Tomnatice fruze prin târg
Aleargă pe drumuri cu droaia.

Un bolnav poet, afectat
Așteaptă tușind pe la geamuri-
O fată, prin gratii, plângând,
Se uită ca luna prin ramuri.

Ea plânge... el palid se pierde
Prin târgul sălbatec, sever;
Și pare tabloul acesta
Că-l antic și plin de mister!"
George Bacovia,Nocturnă,"Nu e nimeni... plouă... plânge-o cucuvaie
Pe-un acoperiș de piatră-n noapte cu ecouri de șivoaie,
Vai, e ora de-altădată, umbre ude se-ntretaie
Și-n curentul unui gang ațipesc, plin de ploaie.

Tabla tuburilor sună aiurarea tuturor...
O grăbită alchimie, fâlfâie o vâlvătaie,
Vai, e ora de-altădată, dungi de ploaie se-ntretaie,
Un oraș de piatră doarme... toate dor.
Nu e nimeni... plouă... plânge-o cucuvaie."
George Bacovia,Poveste,"Îți aduci aminte ziua când ți-am spus că ești frumoasă
Când cu buzele de sânge și cu ochii sclipitori
Printre arborii de toamnă te opreai încet, sfioasă
Lăsând gândul spre amorul înțeles de-atâtea ori...
Așteptai să fiu poetul îndrăzneț ca niciodată
Ca s-auzi ecoul rece-al unor calde sărutări
Te duceai mereu nainte înspre-o umbră întunecată
Ca o pală rătăcire coborând din alte zări.
Ah, mi-ai spus atât de simplu că ți-l sete de iubire
Neascultând decât șoptirea singuraticei păduri,
Îți opreai cu mâna sânul și zâmbea a ta privire,
Chinul depărtării noastre neputând să-l mai înduri.
- Ha, ha, ha, râdea ecoul, de râdeam de-a ta plăcere,
Între om și-ntre femeie mi-ai spus ura din trecut,
Te-am lăsat să-nșiri povestea cu dureri și cu mistere
Pentru mine, ca oricărui trecător necunoscut.
Îți aduci aminte ziua când ți-am spus că ești frumoasă,
Când, în șoaptele pădurii, poate că te-am sărutat
Ascultând ecoul rece, înspre toamna friguroasă
Ce-aducea-ntâlnirii noastre un adio-ndepărtat?"
George Bacovia,Între ziduri,"Cum trec pe lângă case mari... cătând pe nu știu cine...
O, toamnă-n foșnetul de somn s-adorm șoptind de tine...
Pe strada goală vântul deodată face-un salt,
Tăcere e în ganguri și în ogrăzi de-asfalt.

Cum totu-l glorios... cu niciodată pace...
O, toamnă-n foșnetul lung șoptește-mi cum se tace...
O, nu-l nimic, nimic, a fost un vis înalt,
Tăcere e în ganguri și în ogrăzi de-asfalt."
George Bacovia,Frig,"Sunt lângă un gard rupt,
Și vântul bate cu frunze ude-
Sunt mai urât, mai supt,
Frigul începe sticla s-o asude.

Pe strada aplecară la vale
E-o toamnă ca o poezie veche-
Vântul împinge fusta femeilor în cale,
Cu una din ele nu mai puteam fi o pereche.

Toamna rupe afișe și flori,
E mai trist departe-n prăpăstii-
Să faceți foc pe zi de mai multe ori;
O, trebuie să fie trist departe-n prăpăstii...
Fulgi de zăpadă rătăcitori..."
George Bacovia,Dimineață,"O cafea neagră... și-o ploaie de gheață,
Când spiritul mai arde culori în odaie-
O privire pe-o carte, pe straie,
Și pasul mă-ndeamnă în dimineață.

Cum frigul tremurând ca o veste,
Tot plânge de-al meu și de-al tău...
Tot mai mult am rămas cu ce este,
Și plouă cu-o părere de rău.

Am uitat dacă merg... încă tot mai iubesc...
Am ajuns la timp, ocup și un loc.
Dar gândul apasă cu graul său bloc...
E numai vedere... nu mai pot să vorbesc..."
George Bacovia,Romanță,"Parfumul rozelor ude,
Tomnatic suspin,
În zori, în tăcutele trude,
Te cheamă pe tine, puțin.

O tristă poemă de foi
Îmi spune-o poveste de noi...
- Adio, pustiu și fior.
Va fi poate-odată, amor."
George Bacovia,Plumb,"Dormeau adânc sicriele de plumb,
Și flori de plumb și funerar vestmânt-
Stam singur în cavou... și era vânt...
Și scârțâiau coroanele de plumb.

Dormea întors amorul meu de plumb
Pe flori de plumb, și-am început să-l strig-
Stam singur lângă mort... și era frig...
Și-l atârnau aripele de plumb."
George Bacovia,Pastel,"Buciumă toamna
Agonic- din fund-
Trec păsărele
Și tainic s-ascund.

Țârâie ploaia...
Nu-l nimeni pe drum;
Pe-afară de stai
Te-năbuși de fum.

Departe, pe câmp,
Cad corbii, domol;
Și răgete lungi
Pornesc din ocol.

Tălăngile, trist,
Tot sună dogit...
Și tare-l târziu,
Și n-am mai murit..."
George Bacovia,Decor,"Copacii albi, copacii negi
Stau goi în parcul solitar:
Decor de doliu, funerar...
Copacii albi, copacii negri.

În parc regretele plâng iar...

Cu pene albe, pene negre
O pasăre cu glas amar
Străbate parcul secular...
Cu pene albe, pene negre...

În parc fantomele apar...

Și frunze albe, frunze negre;
Copacii albi, copacii negri;
Și pene albe, pene negre,
Decor de doliu, funerar...

În parc ninsoarea cade rar..."
George Bacovia,Amurg,"Trec corbii- ah, ""Corbii""
Poetului Tradem-
Și curg pe-nnoptat
Pe-un târg înghețat,

Se duc pe pustii...
Pe când, de argint,
În amurg de argint,
S-aprinde crai nou,

Pe zări argintii
În vastul cavou...
Iubito, ah, „Corbii""
Poetului Tradem..."
George Bacovia,Lacustră,"De-atâtea nopți aud plouând,
Aud materia plângând...
Sunt singur, și mă duce-un gând
Spre locuințele lacustre.

Și parca dorm pe scânduri ude,
În spate mă izbește-un val-
Tresar prin somn și mi se pare
Că n-am tras podul de la mal.

Un gol istoric se întinde,
Pe-aceleași vremuri mă găsesc...
Și simt cum de atâta ploaie
Piloții grei se prăbușesc.

De-atâtea nopți aud plouând,
Tot trsărind, tot așteptând...
Sunt singur și mă duce-un gând
Spre locuițele lacustre."
George Bacovia,Gri,"Plâns de corbe pe la geamuri se opri,
Și pe lume plumb de iarnă s-a lăsat;
„I-auzi corbii"", mi-am zis singur... și-am oftat,
Iar în zarea grea de plumb
Ninge gri.

Ca și zarea, gândul meu se înnegri...
Și de lume tot mai singur, mai barbar, -
Trist cu-o pană mătur vatra, solitar...
Iar în zarea grea de plumb
Ninge gri."
George Bacovia,Sonet,"E-o noapte udă, grea, te-neci afară,
Prin ceață- obosite, roșii, fără zare-
Ard, afumate, triste felinare,
Ca într-o crâșmă umedă, murdară.

Prin măhălăli mai neagră noaptea pare...
Șivoaie-n case triste inundară-
Ș-auzi tușind o tuse-n sec, amară-
Prin ziduri vechi ce stau în dărâmare.

Ca Edgar Poe, mă reîntorc spre casă,
Ori ca Verlaine, topit de băutură-
Și-n noaptea asta de nimic nu-mi pasă.

Apoi, cu pași de-o nostimă măsură,
Prin întunerec bâjbâiesc prin casă,
Și cad, recad și mai tac din gură."
George Bacovia,Amurg de toamnă,"Amurg de toamnă pustiu, de humă,
Pe câmp sinistre șoapte trec pe vânt-
Departe plopii s-apleacă la pământ
În larg balans lenevos, de gumă.

Pustiu adânc... și-ncepe a-nnopta,
Și-aud gemând amorul meu defunct,
Ascult atent privind un singur punct
Și gem și plâng și râd în hâ, în ha..."
George Bacovia,Tablou se iarnă,"Ninge grozav pe câmp la abator
Și sânge cald se scurge pe canal;
Plină-l zăpada de sânge animal-
Și ninge mereu pe-un trist patinor...

E albul aprins de sânge-nchegat
Și corbii se plimbă prin sânge... și sug;
Dar ceasu-l târziu... în zări corbii fug, -
Pe câmp la abator s-a înnoptat.

Ninge mereu în zarea-noptată...
Și-acum când geamuri triste se aprind
Spre abator vin lupii licărind.
- Iubito, sunt eu la ușa înghețată."
George Bacovia,În grădină,"Scârțâie toamna din crengi ostenite
Pe garduri bătrâne, pe streșini de lemn,
Și frunzele cad ca un sinistru semn
În liniștea grădinii adormite.

O palidă fată cu gesturi grăbite
Așteaptă pe noul amor...
Pe când, discordant și înfiorător,
Scârțâie toamna din crengi ostenite."
George Bacovia,Spre toamnă,"Pe drumuri delirând,
Pe vreme de toamnă,
Mă urmărește-un gând
Ce mă îndeamnă:
- Dispari mai curând!

În casa iubitei de-ajung,
Eu zgudui fereastra nervos,
Și-o chem ca să vadă cum plouă
Frunzișul, în târgul ploios.

Dar, iată, și-un mort evreiesc...
Și plouă, e moină, noroi-
În murmure stranii semite
M-adaug și eu în convoi.

Și nimeni nu știe ce-l asta-
M-afund într-o crâșmă să scriu,
Sau râd și pornesc înspre casă,
Și-acolo mă-nchid ca-n sicriu.

Și mereu delirând
Pe vreme de toamnă,
M-adoarme un gând
Ce mă îndeamnă:
- Dispari mai curând..."
George Bacovia,Pălind,"Sunt solitarul pustiilor piețe
Cu triste becuri cu pală lumină-
Când sună arama în noaptea deplină,
Sunt solitarul pustiilor piețe.

Tovarăș mi-l râsul hidos și cu umbra
Ce sperie câinii pribegi prin canale;
Sub tristele becuri cu razele pale,
Tovarăș mi-l râsul hidos și cu umbra.

Sunt solitarul pustiilor piețe
Cu jocuri de umbră ce dau nebunie;
Pălind în tăcere și-n paralizie, -
Sunt solitarul pustiilor piețe..."
George Bacovia,Amurg violet,"Amurg de toamnă violet...
Doi plopi, în fund, apar în siluete
- Apostoli în odăjdii violete-
Orașul tot e violet.

Amurg de toamnă violet...
Pe drum e-o lume leneșă, cochetă;
Mulțimea toată pare violetă,
Orașul tot e violet.

Amurg de toamnă violet...
Din turn, pe câmp, văd voievozi cu plete;
Străbunii trec în pâlcuri violete,
Orașul tot e violet."
George Bacovia,Decembre,"Te uită cum ninge decembre,
Spre geamuri, iubito, privește-
Mai spune s-aducă jăratec
Și focul s-aud cum trosnește.

Și mână fotoliul spre sobă,
La horn s-ascult vijelia,
Sau zilele mele- totuna-
Aș vrea să le-nvăț simfonia.

Mai spune s-aducă și ceaiul,
Și vino și tu mai aproape, -
Citește-mi ceva de la poluri,
Și ningă... zăpada ne-ngroape.

Ce cald e aicea la tine.
Și toate din casă mi-s sfinte, -
Te uită cum ninge decembre...
Nu râde... citește-nainte.

E ziuă și ce întuneric...
Mai spune s-aducă și lampa-
Te uită, zăpada-l cât gardul,
Și-a prins promoroacă și clampa.

Eu nu mă mai duc azi acasă...
Potop e-napoi și-nainte,
Te uită cum ninge decembre,
Nu râde, citește-nainte."
George Bacovia,Negru,"Carbonizate flori, noian de negru...
Sicrie negre, arse, de metal,
Vestminte funerare de mangal,
Negru profund, noian de negru...

Vibrau scântei de vis... noian de negru,
Carbonizat, amorul fumega-
Parfum de pene arse și ploua...
Negru, numai noian de negru..."
George Bacovia,Nevroză,"Afară ninge prăpădind,
Iubita cântă la clavir,
Și târgul stă întunecat,
De parcă ninge-n cimitir.

Iubita cântă-un marș funebru,
Iar eu nedumerit mă mir:
De ce să cânte-un marș funebru...
Și ninge ca-ntr-un cimitir.

Ea plânge, și-a căzut pe clape,
Și geme greu ca în delir...
În dezacord clavirul moare,
Și ninge ca-ntr-un cimitir.

Și plâng și eu și tremurând
Pe umeri platele-l resfir...
Afară târgul stă pustiu
Și ninge ca-ntr-un cimitir."
George Bacovia,Moină,"Și toamna și iarna
Coboară-amândouă;
Și plouă și ninge, -
Și ninge și plouă.

Și noaptea se lasă
Murdară și goală;
Și galbeni trec bolnavi
Copii de la școală.

Și-s umezi păreții,
Și-un frig mă cuprinde-
Cu cei din morminte
Un gând mă deprinde...

Și toamna și iarna
Coboară-amândouă;
Și plouă și ninge, -
Și ninge și plouă."
George Bacovia,Melancolie,"Ce chiot, ce vaiet în toamnă.
Și codrul, sălbatec vuiește-
Răsună-n coclauri un bucium,
Și doina mai jalnic pornește.

Ascultă, tu, bine, iubito,
Nu plânge și nu-ți fie teamă,
Ascultă cum greu, din adâncuri,
Pământul la dânsul ne cheamă..."
George Bacovia,Rar,"Singur, singur, singur,
Într-un han, departe-
Doarme și hangiul,
Străzile-s deșarte,
Singur, singur, singur...

Plouă, plouă, plouă...
Vreme de beție-
Și s-asculți pustiul,
Ce melancolie!
Plouă, plouă, plouă...

Nimeni, nimeni, nimeni...
Cu atât mai bine-
Și de-atâta vreme
Nu știe de mine
Nimeni, nimeni, nimeni...

Tremur, tremur, tremur...
Orice ironie
Vă rămâne vouă-
Noaptea e târzie,
Tremur, tremur, tremur...

Veșnic, veșnic, veșnic...
Rătăciri de-acuma
N-or să mă mai cheme-
Peste vise bruma,
Veșnic, veșnic, veșnic...

Singur, singur, singur...
Vreme de beție-
I-auzi cum mai plouă,
Ce melancolie!
Singur, singur, singur..."
George Bacovia,Nervi de toamnă,"E toamnă, e foșnet, e somn...
Copacii, pe stradă, oftează;
E tuse, e plânset, e gol...
Și-l frig și burează.

Amanții, mai bolnavi, mai triști,
Pe drumuri fac gesturi ciudate-
Iar frunze de veșnicul somn
Cad grele, udate.

Eu stau și mă duc și mă-ntorc,
Și-amanții profund mă-ntristează-
Îmi vine să râd fără sens,
Și-l frig și bureză."
George Bacovia,Seară tristă,"Barbar, cânta femeia-aceea,
Târziu, în cafeneaua goală,
Barbar cânta, dar plin de jale, -
Și-n jur era așa răscoală...
Și-n zgomot monstru de țimbale,
Barbar, cânta femeia-aceea.

Barbar, cânta femeia-aceea...
Și noi eram o ceată tristă-
Prin fumul de țigări, ca-n nouri,
Gândeam la lumi ce nu există...
Și-n lungu, satanice ecouri
Barbar, cânta femeia-aceea.

Barbar, cânta femeia-aceea,
Și-n jur era așa răscoală...
Și nici nu ne-am mai dus acasă,
Și-am plâns cu frunțile pe masă,
Iar peste noi, în sala goală, -
Barbar, cânta femeia-aceea..."
George Bacovia,Note de toamnă,"Tăcere... e toamnă în cetate...
Plouă... și numai ploaia dă cuvânt-
E pace de plumb, e vânt și pe vânt
Grăbite trec frunze liberate.

Deschide, dă drumu-adorato,
Cu crengi și foi uscate am venit;
În târg, o fată tristă a murit, -
Și-au dus-o pe ploaie, și-au îngropat-o...

Dă drumu, e toamnă în cetate-
Întreg pământul pare un mormânt...
Plouă... și peste târg, duse de vânt,
Grăbite, trec frunze liberate."
George Bacovia,"Oh, amurguri","Oh, amurguri violete...
Vine
Iarna cu plânsori de piculine...

Peste parcul părăsit
Cad regrete
Și un negru croncănit...

Veșnicie,
Enervare...
Din fanfare funerare
Toamna sună, agonie...

Vânt de gheață s-a pornit,
Iar sub crengile schelete, -
Hohot de smintit.

Nici o urmă despre tine.
- Vine, nu vine?...
Oh, amurguri violete..."
George Bacovia,Amurg de iarnă,"Amurg de iarnă, sumbru, de metal,
Câmpia albă- un imens rotund-
Vâslind, un corb încet vine din fund,
Tăind orizontul, diametral.

Copacii rari și ninși par de cristal.
Chemări de dispariție mă sorb,
Pe când, tăcut, se-ntoarce-același corb,
Tăind orizontul, diametral."
George Bacovia,Alean,"E-n zori, e frig de toamnă,
Și cât cu ochii vezi
Se-ncolăcește fumul
Și-l pâclă prin livezi.

Răsună, trist, de glasuri
Câmpiile pustii, -
Și pocnet lung și chiot
S-aude-n deal la vii.

C-un zmeu copiii-aleargă,
Copil, ca ei, te vezi,
Și plângi... și-l frig de toamnă...
Și-l pâclă prin livezi."
George Bacovia,Amurg antic,"Havuzul din dosul palatului mort
Mai aruncă, mai plouă, mai plânge-
Și stropii căzând, în amurg, iau culori:
De sineală, de aur, de sânge.

Plutește un lanț de lebede albe,
Iar visul din parc în lac se răsfrânge-
Amurgul pe lebede pune culori:
De sineală, de aur, de sânge.

Uitate, statuile albe privesc,
Albe visând cu-n aer ce plânge-
Și lasă amurgul pe ele culori:
De sineală, de aur, de sânge."
George Bacovia,Pulvis,"Imensitate, veșnicie,
Tu, haos, care toate-aduni...
În golul tău e nebunie, -
Și tu ne faci pe toți nebuni.

În fața ta sunt cel mai laș.
Imensitate, veșnicie, -
Iubesc o fată din oraș...
Învață-mă filosofie.

Imensitate, veșnicie,
Pe când eu tremur în delir,
Cu ce supremă ironie
Arăți în fund un cimitir."
George Bacovia,Cuptor,"Sunt câțiva morți în oraș, iubito,
Chiar pentru asta am venit să-ți spun;
Pe catafalc, de căldură-n oraș,
Încet, cadavrele se descompun.

Cei vii se mișcă și ei descompuși,
Cu lutul de căldură asudat;
E miros de cadavre, iubito,
Și azi, chiar sânul tău e mai lăsat.

Toarnă pe covoare parfume tari,
Adu roze pe tine să le pun;
Sunt câțiva morți în oraș, iubito,
Și-ncet cadavrele se descompun..."
George Bacovia,Toamnă,"Răsună din margini de târg
Un bangăt puternic de armă;
E toamnă... metalic s-aud
Gorniștii, în fund, la cazarmă.

S-aude și-un clopot de școală,
E vânt, și-l pustiu, dimineață;
Hârtii și cu frunze, de-a valma,
Fac roată-n vârteje, pe-o piață.

Se uită în zări catedrala,
Cu turnu-l sever și trufaș;
Grădina orașului plânge,
Și-aruncă frunzișu-n oraș.

Și vine, ca-n vremi de demult,
Din margini, un bucium de-alarmă,
E toamnă... metalic s-aud
Gorniștii, în fund, la cazarmă."
George Bacovia,Singur,"Potop, cad stele albe de cristal
Și ninge-n noaptea plină de păcate;
La vatră-n para ce abia mai bate-
Azi, a murit chiar visul meu final.

Și ninge-n miezul nopții glacial...
Și tu iar tremuri, suflet singuratec, -
Pe vatră-n para slabă, în jăratec, -
Încet, cad lacrimi roze de cristal."
George Bacovia,Trudit,"Iubito și iar am venit...
Dar astăzi, de-abia mă mai port-
Deschide clavirul și cântă-mi
Un cântec de mort.

Și dacă-am să cad pe covoare
În tristul, tăcutul salon, -
Tu cântă nainte, iubito,
Încet, monoton."
George Bacovia,Amurg,"Ca lacrimi mari de sânge
Curg frunze de pe ramuri,
Și-nsâgerat, amurgul
Pătrunde-ncet prin geamuri.

Pe dealurile-albastre,
De sânge urcă luna,
De sânge pare lacul,
Mai roș ca-ntotdeauna.

La geam tușește-o fată
În bolnavul amurg;
Și s-a făcut batista
Ca frunzele ce curg."
George Bacovia,Altfel,"Omul începuse să vorbească singur...
Și totul se mișca în umbre trecătoare-
Un cer de plumb de-a pururea domnea,
Iar creierul ardea ca flacăra de soare.

Nimic. Pustiul tot mai larg părea...
Și-n noaptea lui amară tăcuse orice cânt; -
Și-nvinețit de gânduri, cu fruntea în pământ,
Omul începuse să vorbească singur..."
George Bacovia,Panoramă,"Plângea caterinca-fanfară
Lugubru în noapte, târziu...
Și singur priveam prin ochene,
Pierdut în muzeul pustiu...

Și-n lumea ochenelor triste
Mă prinse sinistre gândiri-
În jurul meu corpuri de ceară,
Cu hâde și fixe priviri.

Și-acea caterincă-fanfară
Îmi dete un tremur satanic;
În racle de sticlă- princese
Oftau, în dantele, mecanic,

Și-atunci am fugit plin de groază
Din sumbrul muzeu fioros,
Orașul dormea în tăcere,
Flașneta plângea cavernos.

Plângea caterinca-fanfară
O arie tristă, uitată...
Și stam împietrit... și de veacuri,
Cetatea părea blestemată."
George Bacovia,Finis,"Cadavrul impozant pe catafalcul falnic,
Sub gaza de argint visa în vasta sală...
Iar sânul ei pierdut în mortuara gală-
Pe veci oprit, înmărmurise falnic.

Pustiu...

Departe, în cetate viața tropota...
O, simțurile-mi toate se enervau fantastic...
Dar în lugubrul sălii pufneau în râs sarcastic
Și Poe și Baudelaire și Rollinat."
George Bacovia,Plumb de iarnă,"Iarna, de-o vrame, mă duce regretul
Prin crânguri, pe margini de linii ferate-
Trec singur spre seară pe ape-nghețate,
Când fâlfâie, pe lume, violetul.

Paloarea, mutismul minează-al meu pipt
Pe satele ninse crai nou când apare;
Trec singur pe poduri de fier solitare,
Și-aștept în zăpadă... dar ce mai aștept?

Hau!... Hau!... depărtat sub stele-nghețate...
În noaptea grozavă la voi cine bate?...
O, vis... o, libertate...
Hau!... Hau!... depărtat sub stele-nghețate..."
George Bacovia,Nocturnă,"Stau... și moina cade, apă, glod...
Să nu mai știu nimic, ar fi un singur mod-
Un bec agonizează, există, nu există, -
Un alcoolic trece piața tristă.

Orașul doarme ud în umezeala grea,
Prin zidurile astea, poate, doarme ea, -
Case de fier în case de zid,
Și porțile grele se-nchid.

Un clavir îngână-ncet la un etaj,
Umbra mea stă în noroi ca un trist bagaj-
Stropii sar,
Ninge zoios,
La un geam, într-un pahar,
O roză galbenă se uită-n jos."
