autor,titlu,text
Mihai Eminescu,Eco,"Cu-ncetu-nserează și stele izvorăsc.
Pe-a cerului arcuri mărețe.
În umede lanuri de-albastru ceresc,
Merg norii cu hainele crețe
Și stâncile rar
Ca stâlpii răsar,
Negriți și-ndoiți de furtună
În lună.

Sclipire e-n aer, în codri - miros
Și umbră adânc viorie;
Și luna-i e cerului scut argintos
Și stele păzesc în tărie
Și văile sunt
În aburi de-argint.
Pierdute-ntr-al doinelor șuier
Din fluier.

Pe-un cal care soarbe prin nările-i foc,
Din ceața pustie și rece,
Un tânăr, pe vânturi, cu capul în jos,
Cu clipa gândirei se-ntrece
Și calu-i turbat
Zbura necurmat,
Mânat ca de-a spaimelor zână
Bătrână.

Pe umeri de munte, din stânci de bazalt
Castelul se nalță, se-ncruntă,
Și-a murilor muche si creștetu-i nalb
De nouri și ani se-ncăruntă,
Dar astăzi e viu
Și-n glas auriu
Răsună din umbra lui mare
Cântare.

În mii de lumine ferestrele-i ard,
Prin cari se văd trecătoare,
Prin tactul cântării pierdute de bard,
Îvindu-se umbre ușoare;
Trec albe ca-n vînt
Dulci neguri de-argint,
Palatul plutea în magie
Aurie.

Ca cerbul uimit, ce prin creștet de stânci
E-urmat de săgeat-arzătoare,
Din căi năruite, din gârle adânci,
Fugarul în tropot răsare
Cu nari arzând
Cu coama pe vînt;
O dată-ncă pinten l-împunge
Și-ajunge.

Iar tânărul sare ușor de pe el
Și prundul sub pasu-i răsună.
Frumos ca din basme și tras prin inel
Și nalt ca si bradul în lună,
C-un salt a suit
Al bolții granit.
Urcat într-un arc de fereastă
Adastă.

Mantua lui neagră în lună s-a-ntins
De pare-o perdea în fereastă
Și gratii de fier a lui mână-a cuprins
Uitându-se-n sala cea vastă.
Pe stînci de bazalt
Stă calu-i înalt
Și coama-i i-o îmflă în lună
Furtună.

Sala-i ca aerul scăldat în soare,
Muiat de-a florilor suflet răcoare
În ea frumoasele ființe albe
Par gânduri palide din visuri dalbe.
De-umărul junilor de razim, zboară,
De raze umede. ochii-s izvoare,
Ca-n vânt se leagănă zveltele poze
Prin păr ce flutură cununi de roze...
Și beți de muzică plutesc ca vântul,
Jocul e repede, încet e cântul
Și pe când sufletul stă de beție
Plutesc ființele... o vijelie...
Până ce aria dispare, trece...
O rază timidă în ziua rece.
Apoi perechile stând risipite
S-adun în grupele orânduite
Și din amestecul de vise dalbe,
Din trecătoarele ființe albe,
Iese ca aria dintre suspine
Regina albelor nopții regine,
Sau cum din zilele poetic june
A idealului iese minune.
Parui ca aurul fața-ncadrează,
Cunună-n undele-i se furișează,
Se-ndoaie talia-i în albă haină
Parcă-i o timidă a nopții taină.
Pe-o liră gingașă și argintie
Mânuța-i coardele le-ncurcă vie,
Prin blânde notele lirei de-amor
Glasul ei tremură dulce ușor:

Prin bolta ferestei înguste
Mă uit într-al văilor rai,
Cum codrii în cale-i supune
Furtuna, copila de crai.

Prin păru-i de aur, coroană
Cu colțuri în fulger și jar,
Ea apele-n cale-i aplană
Și-ndoaie bătrânul stejar.

Prin poarta îngustă din murii
Grădinei, cetății-mi din stânci,
Cobor în adâncul pădurii
Unde-izvoarele murmur adânci.

Prin nourii rupți trece luna
Și-n sufletu-mi dor a pătruns,
Și părul mi-l îmflă furtuna
Și-ochii-mi se-neacă de plâns.

Doresc doar ca în fundul mării
Să mă ia cu sine-n sarai,
În nalte -albastrele sale,
Furtuna, copila de crai.

Dorese ca să intru  cu luna
În dome de nouri, ce pier
Doresc cu popoare -de stele
Să merg drumul mare din cer.

Ce caut eu nu vă știu spune,
Eu singură nu știu ce vreu,
Atât e de tainic ascunsă
Dorința în sufletul meu.

Mi-e ciudă pe frunza cuminte,
Pe vorbărețe valuri de râu,
Ele-mi spun ce dorește-al meu suflet.
Ce  singură eu nu știu.

Și flori și crenge și stele .
În ciuda mea taine îmi spun -
Ah ! cum le-aș smulge pe toate
Să fac din ele cununi.

În codru o creangă se-ndoaie,
O poartă prin frunze, și-n prag
Un chip cu ochi magi se ivește
Ah! cum mi-ar putea fi de drag.

Un murmur feeric desmiardă voios
A salei tăcere senină.
Din bolta ferestrei arcată pompos
S-aude vibrând mandolină

Și-un eco ușor
Petrece cu-amor;
Cu dulcea vibrare de strune,
Ce spune.

Și toată viața lui, tot ce-a cules
Din unde, din munte, din vale,
Tot sufletu-i june, tot scumpu-i eres
Alunecă-n cântecu-i moale
Ș-al coardelor grai,
Frumos ca din rai,
Amestecă-n vorbe de miere
Durere:"
Mihai Eminescu,Sara pe deal,"Sara pe deal buciumul sună cu jale,
Turmele-l urc - stelele scapără-n cale;
Apele plâng clar izvorând în fântâne,
Sub un salcâm, dragă, m-aștepți tu pe mine.

Luna pe cer trece așa sfântă și clară,
Ochii tăi mari caută-n frunza cea rară,
Stelele nasc umezi pe bolta senină,
Pieptul de dor, fruntea de gânduri ți-e plină.

Nourii curg, raze-a lor șiruri despică,
Streșine vechi, casele-n lună ridică.
Scârție-n vânt cumpăna de la fântână,
Valea-i în fum, fluiere murmură-n stână.

Și osteniți oameni cu coasa-n spinare
Vin de la câmp; toaca răsună mai tare,
Clopotul vechi împle cu glasul lui sara,
Sufletul meu arde-n iubie ca para.

Ah ! În curând satul în vale-amuțește,
Ah ! În curând pasu-mi spre tine grăbește,
Lângă salcâm sta-vom noi noaptea întreagă,
Ore întregi spune-ți-oi cât îmi ești dragă !

Ne-om rezima capetele-unul de altul
Și surâzând vom adormi sub înaltul,
Vechiul salcâm. - Astfel de noapte bogată
Cine pe ea n-ar da viața lui toată?

Pe vârful de munte, în codri-mbrăcat,
De nouri grămezi se adună
Și unul pe altul, măiestru urcat,
Ei par o cetate în lună.
Și bolțile-n muri
Și stâlpii sunt suri,
Lumina prin arc de fereastră
E-albastră.

În halele-albastre - 'nstelatele bolți
Te uiți prin coloane de nouri
Și luna ieșind dintr-a stâncilor colți
Le împle cu mii de tablouri.
Lumina-i de-argint
În nouri s-a frânt
Și se-ncheagă prin naltele dome
Fantome.

În hainele albe de neguri de-argiint
Și creții de roze purpure,
Și părul pe frunte cu stele e prins,
Ca îngerii albe și pure
Prin gene de nor,
Ca visuri strecor,
Ducând înstelata lor viață
Prin ceață.

Un șuier în noapte, prin codri, un vânt,
Un freamăt - și totul dispare.
Și nori se-ncrețesc risipiți, și s-avânt.
În lună stau stâncile rare
Iar junele-iubit
E-un brad putrezit
Pe trunchi de granit, pe ruine
Bătrâne."
Mihai Eminescu,Odin și poetul,"Ei cer să cânt... durerea mea adâncă
S-o lustruiesc în rime și-n cadențe
Dulci ca lumina lunei primăvara
Într-o grădină din Italia.
Să fac cu  poezia mea cea dulce
Damele să suspine; ce frumoase
Pot fi pentru oricine. Pentru mine
Nu. Și juni nătângi cu țigarete-n gură;
Frizați, cu sticla-n ochi, cu cioc sub dinți,
Să reciteze versuri de-ale mele
Spre-a coperi cu-espresia adâncă
Unei simțiri adevărate - niște mofturi.
Mai bine-aș smulge sufletul din mine,
Aș stoarce cu o mână crudă, rece
Tot focul sânt din el, ca în scânteie
Să se risipe, pân' ce va-njosi
Să animeze pe deșerți și răi.
O, și de-ați plânge chiar, dacă durerea
Adevărată și neprefăcută
V-ar topi ochii și a mea cântare
V-ar arde sufletul din voi... Atuncea
E și mai rău  și-atunci și mai puțin
Va gândi cineva pe un moment
L-acel nefericit ce le-a avut.
Voi le citiți, ca să puteți a plânge
- Căci prin izvor de lacrimi mor dureri -
Voi știți c-o mână - oricare-ar fi -v-atinge
Fruntea cea plină de sudori, și dulce
Va răcori bolnava fierbințeală
Și stavilă la lacrime vă pune
C-o sărutare... La mine,
Ce singur stau  cu frunte-ntunecată,
Ce nu pot plânge pentru că durerea
Ochii-mi a stors si sufletul meu aspru
L-a împietrit... la mine
Nimeni nu va gândi, nici a gândit.
La ce? Au nu știu ei cu toții
Că dacă vor seca a mea durere
Cu mângâieri - atuncea și izvorul
De cânturi va seca... Nebuni! vă iert...
O, mare, mare înghețată, cum nu sunt
De tine-aproape să mă-nec în tine !
Tu mi-ai deschide-a tale porți albastre,
Ai răcori durerea-mi înfocată
Cu iarna ta eternă. Mi-ai deschide
A tale-albastre hale si mărețe;
Pe scări de valuri coborând în ele,
Aș saluta cu aspra mea cântare
Pe zeii vechi și mândri ai Valhalei.
Bine-ai venit, tânăr cu ochi din ceriuri,
Râzând Odin și ridicându-și cupa
V-ar saluta. - Și haina ceea lungă
Și albă creții ar arunca de neauă
Și părul lung mi s-ar îmfla de vânt.
Un scaun pentru bard - și-n scaunul nalt
De piatră, cu sprijoanele lui nalte,
Nu m-aș simți că-s uriaș.
Și zeii mângâind lungele barbe,
Nălțând privirea-n bolțile antice
Spre a-și reaminti dulci suveniri,
M-ar asculta spunându-le de lumea
Cea de pitici, ce viermuiește astăzi
Pe țărâna ce-au locuit-o ei.
Lasă-i pustiei, cine-ar fi crezut
C-atât de mizerabilă a deveni
Sămânța cea din zei născută.
Dar un bătrân ce sta-ntr-un colț de masă
Ridică cupa lui cu mied: - Ascultă,
Nu mi-i ști spune ce mai face țara
Ce Dacia se numea - regatul meu' il
Tai stă-nrădăcinată-n munți de piatră,
Cu murii de granit, cu turnuri gote,
Cetatea-mi veche Sarmisegetuza'
- Nicicum, o, Decebal. O văd
Pentru întâia dată acum înălțată !
Prin părul tău ca o coroană mândră,
Lucrată-n pietre scumpe ca-n granit.
- Dară urmașii acelor romani?
Ce să vorbesc de ei? Toți oamenii
Pigmei sunt azi pe vechiuh glob... dar ei
Între pigmeii toți sunt cei mai mici -
Mai slabi, mai fără suflet, mai mișei.
Romani sau daci, daci sau romani, nimic
N-aduce aminte de-a voastră mărire.
Orice popor, oricit de prăpădit
O piatră va găsi, sau o bucată
De fier, ori de aramă, ca să sape
Cu ea urmele-adânci ce le-ați lăsat -
Voi oameni mari, ce stați acum cu zeii
Și ospătați cu ei - în colbul negru
Uitat ș-usor al vechiului pământ.
Dar ei... De-ar merge-n sud și nord - nimica
Sunt ca o laie de nomazi și de lăieți
Ce stau deocamdată numai pre pământul
Ce l-au cuprins, spre a fi alungați
De alt popor mai tare, iubitor
De cele ce-au trecut, ce-s rădăcina
Și gloria celor ce sunt.
- Ah ! ce-am dorit în ora morții mele,
Roma să guste pân-în fund păharul
Mizeriei și-a decăderii, într-atât
Încât să se desprețuiască ei pe sine -
Asta s-a împlinit... Romanii vechi și mândri,
Învingătorii lumii, au devenit
Romunculi... Dar cu ce s-ocupă ei?
Or fi crescând căței, or fi-nvățind
Să strige ca cucoșii... un popor
Ce se desprețuiește pe el însuși trebui
S-ajungă la d-acestea.
- Nu, vorbesc franțuzește și fac politică.
- E tot atâta.
- De unde vii? întreabă Odin blând.
- Am răsărit din fundul Mărei Negre,
Ca un luceafăr am trecut prin lume,
În ceruri am privit și pe pământ
Și-am coborât la tine, mândre zeu,
Și la consorții tăi cei plini de glorii.
De cântec este sufletul meu plin.
De vrei s-auzi al iernii glas vuind
Și lunecând prin strunele-mi de fier,
De vrei s-auzi cum viscolește-n arfa-mi
Un cânt bătrân și răscolind din fundu-i
Sunete-adânci și nemaiauzite,
Ordonă numai - sau de vrei ca fluviul
De foc al gândurilor mele mari
Să curgă-n volbură de aur pe picioare
De stânci bătrâne, într-o limbă aspră
Și veche - însă clară și înaltă
Ca bolțile cerului tău, o, Odin,
Spune-mi atunci, su-nstrun ale ei coarde
Ca să-mi câștig cununa mea de laur.
Poate-ar fi vrut ei să mi-o deie...
Dară de la pitici eu nu primesc nimica.
Sărman copil - zite bătrânul zeu
De ce răscolești tu toată durerea
Ce sufletul tău tânăr a cuprins ?
Nu crede că-n furtună, în durere,
În arderea unei păduri bătrâne,
În arderea și-amestecul hidos
Al gândurilor unui neferice
E frumusețea. Nu - în seninul,
În liniștea adâncă sufletească,
Acolo vei găsi adevărata,
Unica frumusețe...
(Fruntea-i naltă,
De neauă coperită, și coroana-i
De stele-albastre strălucea în hală,
Și vorba lui blândă era duioasă.) -
Din cupa mea de aur bea auroră
S-între seninul blândei diminețe
În pieptul tău. Și ti-oi deschide-atunci
Portalele nalte de la hale
Cu lungi coloane de zăpadă, cu-arcuri
De neauă albă, ca argint din Ophir,
Cu bolți mai nalte decât însuși cerul.
Acolo printr-acele lungi coloane
Suspendă lampe mari ca niște albe lune
Ce împlu lumea raiurilor mele
Cu o lumină dulce, albă, caldă,
Stâlpii sclipesc, bolțile-s strălucite,
Cărările-s de pulbere mai albă
Ca-argintul cel de viu. - Un aer
Blând argintiu îți va îmfla tot părul,
Vei răsufla miroase dulci de crin;
Talarul tău va lumina în noapte
Prin hale vei zări blândele-mi zâne,
Și-atunci să cânți. Vei ști ce a frumos.
O vorbă zice - murii cei albaștri
Ai mării, desfăcutți în două-mi lasă
Privirea într-un labirint de neauă:
Coloane nalte, bolți arcate splendid,
Pe ele lune lin ardeau... și-n umbra
Cea clar-obscură-a stâlpilor de neauă
Văzut-am o copilă dulce-înaltă,
Subțire ca-ntruparea unui crin.
Frumosu-i păr de aur desfăcut
Cădea pân' la călcâie, haina-i albă
Udă părea de moale - strălucită
Cuprindea membrii ei dulci si zvelți,
Mânile-i mici, ca doi crini albi, încearcă
În van a împleti părul de aur
Gura-i o roză surâzînd deschisă,
Ochii-i albaștri luminau ca stele,
Iar pe-a ei umeri albi abia se ține
Haina cea lungă și bogată. - Vino,
Odin îi zice, blând copil al mării.
Un bard sătul de-a lumii lungi mizerii
S-au coborât în noaptea noastră clară -
Să cânte roagă-l. Ca o umbră
Strălucind argintiu în clară noapte
Muiată în aurul pletelor ei,
S-apropie... - O, nu te teme,-mi zice,
Tu, ce nu temi furtuna și durerea,
De ce să tremuri la a mea privire ?
Lin tremură glasul ei blând în noapte.
- O, zână, nu de frică, de plăcere
Tremură-n mine sufletul meu bolnav.
Să cânt? Dar oare la a ta privire
Nu amuțește cântul de-admirare -
Nu ești un cântec însăși - cel mai dulce,
Cel mai frumos, ce a fugit vodată
Din arfa unui bard ? O, fecioară,
Vin' lângă mine, să mă uit în ochii-ți,
Să uit de lume, ah! să pot uita
Fierea cu care ei m-au adăpat
În lame. Cine-ar fi știut
Că-n fundul mării tu trăiești, copilă,
Ca un mărgăritar, topit din visul
Mării întregi,
Și nu te temi că aurul din plete-ți
Se va topi în stele - și că păru-ți
Amestecat cu ele-ar străluci
În noapte-albastră a acestei lumi;
Și nu te temi că glasul tău
Va-ndulci vecinicia cea amară
A mării! - Măgulitor, ea zice,
Ș-o roză ea lăsă pe a mea gură,
Cu tânăr miros - roza gurei sale.
- Frumoasă ești, ca să găsese cuvinte
Spre-a îndulci ochii tăi mari albaștri,
Sufletul tău cel blând, nevinovat,
Aș sfărma soarele în țăndări de-aur,
L-aș presăra-n cărarea ca de neauă:
O închinare l-a tale picioare
Mici, dulci și albe. O, Odin,
Pune-i un sceptru-n mână, sceptrul murii,
Pe fruntea ei coroană pune, mare,
De diamante, umede, topite
În strălucirea lor cea înfocată,
Căci ea-i regina frumuseții - a lumii.
Ea capu-și rezemă de ai mei umeri
Și glasul ei îmi șopti în ureche
Voi îndulci tot chinul, tot amarul
Cu care-n lume ei te-au adăpat
Căci te iubesc, sărmanul meu copil.

Și Odin își deschise ochii albaștri
Și mari, râzând cu ei - iar zeii
Lin șoșoteau între ei bătrânește
Și surâzând îsi aduceau aminte
De-a tinereții zile dulci a lor, ascunse
În negura secolilor trecuți."
Mihai Eminescu,Pustnicul,"Sala-mbrăcată cu-atlas alb ca neaua,
Cusut cu foi și roze vișinii,
Și ceruită strălucea podeaua
Ca și-aurită sub lumine vii
Lumini de-o ceară ca zăharu - o steaua,
Diamant topit pe-oricare din făclii.
Argint e-n sală și de raze nins
E aerul pătruns de mari oglinzi.

Copile dulci ca îngerii - virgine
Prin sală trec purtând cununi de flori;
Ah! vorba înger scapă pe oricine
De lungi descrieri, dulce cititori
Astfel acum ea mă scăpă pe mine
Să zugrăvesc terestrele comori,
Acele dulci, frumoase, june-scule
Cu minți deșerte și cu inimi nule.

La ce-aș descrie gingașa cochetă,
Ce-abia trecută de-optsprezece ani,
Priviri trimite, timide, șirete,
Când unui tont, ce o privea avan,
Când unui ghiuj, cu mintea căpietă,
Urât ș-avar, sinistru și pleșcan.
Sau unui general cu talia naltă,
Strigău și prost ca și un bou de baltă?

Să cânt cum samănă de rău, impulsul
În corp de înger, sufletul diform ?
Ironiei lui Byron să-i simt pulsul,
Ori autorului ce-a scris Marion Delorme?
Să descriu nopți romantice? - Avulsul
Ce apele plângând le-aruncă - adorm
Chiar îngerii - și în azur muiete
Curg stele de-aur dulci și-mprăștiete ?

Și să discos dar inima femeii
Suspină-n nopii albastre, plin' de-amor?
Ah, a ei patimi au firea scânteii:
În clipa ce le naște ele mor;
Închideți ochii, căci păzească zeii
L-a lor lucire să te uiți cu dor:
Abisuri sunt în suflet. Pe o clipă
Pasiunea li lumin-a lor risipă.

La ce escursiuni ? - Ce nu sunt oare
Unde v-au dus, în sala cea de bal,
Pe înflorite, dulci și moi covoare,
Unde mii flori mirosul lor ezal;
Sub a perdelei umbră scutitoare,
Ce de trădarea mândrului cristal
Al marilor oglinzi te scapă sigur,
Când vrei s-observi cum grupe se configur.

Deci după o perdea! Pe-o moale sofă
Alene șade-un înger de copil.
În păru-i negru-o roșie garofă.
În ochi albaștri plutitori ș-agil
Și haina de-albă, strălucită stofă
Cuprinde-un mijloc mlădiet-gentil,
Ce lin se-ndoaie parc-ar sta să culce
Sub evantaliu-i ce plutește dulce.

Un înger, da! aripa doar se cade
Pe ai ei umeri albi ca neaua, goi,
Spre-a fi un îngeraș precum se cade.
Ș-apoi ce bine-i ca s-o credeți voi.
Cine-ar ghici vodată cum că șade
Un demon crud în suflet de noroi?
Cu vorba înger însă eu săracul
Mă voi scuti de a descri - pe dracul:"
Mihai Eminescu,La moartea lui Eliade,"Tăceți! Cearta amuțească - E-o oră grea și mare
Aripele ei negre în ceruri se întind,
Astfel lumea-amuțește la-ntunecări solare,
Astfel marea-amuțește, vulcane când s-aprind,
Când prin a vieții visuri - oștiri de nori - apare
A morții umbră slabă cu coasa de argint.
Tăceti! Cum tace-n spaimă a Nordului popor,
Când evul asfințește și dumnezeii mor.

Aducați-vă aminte de-acele nalte poze
De frunțile-n lumină a vechilor profeți,
Pe un pustiu de piatră, pe cer d-azur și roze
Trecu un stâlp de flacări ce lumina măreț
Și-n fruntea unui popol pierdut în chin - e Moze,
Și sufletul lui mare, adâne și îndrăzneț,
Prevede că din sânul pierdutului popor
E viitorul lumii și-al ei mântuitor.

El n-a văzut pământul promisiei divine,
Viața lui se stinse în munții slabi și suri,
Corpul i-l poartă-ntregul pustiu fără de fine,
O ginte-ntreagă poartă a lui învățături,
Ca-nmormântată-n secoli cenușa lui rămâne,
Dar spiritu-i sfăramă înalții, vechii muri
De Iericho -- și-n gânduri și-n biblia lui scrisă
Viața-ntreagă mare-a unui popor e-nchisă.

Astfel în noaptea noastră pierdută și amară,
Un glas de deșteptare adânc a răsunat,
O stea a supt puternic eclipsa cea solară,
Un stâlp pin chinuire un drum ne-a arătat,
O arfă de aramă cu coarda temerară
Trezi-n sufletul nostru simțire de bărbat,
Ca gIasul Providenței din stinsele decade,
Astfel s-auzi glasu-ți, bătrâne Eliade!

O, limba lui! Îmi pare c-aud cum ea răsună
În aspra ei mânie, zidind nor peste nor,
Din ștearsa, nențeleasa a istoriei rună
A descifrat al ginții puternic viitor.
El  trece peste timpuri, pe valuri cum furtuna,
Valuri care în ceartă se scutură si mor,
Os magna sonaturum!  Idei c-ale lui Crist
În limba inspirată-a unui evanghelist.

Inima lui cea mare menită fu de soartă
Să nască-ntr-un timp rece, căzut, degenerat,
Alstfel în fundul negru, adânc din marea moartă,
Cu-ape de plumb, cu valuri greoaie-n a ei pat,
Vulcan puternic, care cutremur în el poarta,
Cu razele-i de flacări ar fi acufundat,
Pân' ce deodată mândre, gândirile-i irump
Pin undele greoaie, pin apele de plumb."
