autor,titlu,text
Mihai Eminescu,La Bucovina,"N-oi uita vreodată, dulce Bucovină,
Geniu-ți romantic, munții în, lumină,
Văile în flori,
Râuri resăltânde printre stânce nante,
Apele lucinde-n dalbe diamante
Peste câmpii-n zori.

Ale sorții mele plângeri și surise;
Îngânate-n cânturi,  îngânate-n vise
Tainic și ușor,
Toate-mi trec prin gându-mi, trec pe dinainte,
Inima mi-o fură și cu dulci cuvinte
Îmi șoptesc de dor.

Numai lângă sînu-ți geniile rele,
Care îmi descântă firul vieții mele,
Parcă dormita;
Mă lăsară-n pace, ca să cânt în lume,
Să-mi visez o soarte mândră de-al meu nume
Și de steaua mea.

Când pe bolta brună tremură Selene,
Cu un pas melodic, cu un pas alene
Lin în calea sa,
Eol pe-a sa arpă blând răsunătoare,
Cânt-a nopții dulce, mistică cântare,
Cânt din Valhala.

Atunci ca și silful, ce n-adoarme-n pace,
Inima îmi bate, bate, și nu tace,
Tremură ușor,
În fantazii mândre, ea își face cale,
Peste munți cu codri, peste deal și vale
Mână a ei dor.

Mână doru-i tainic colo, înspre tine,
Ochiul îmi sclipește, genele-mi sunt pline,
Inima mi-e grea;
Astfel, totdeuna cînd gândesc la tine,
Sufletul mi-apasă nauri de suspine,
Bucovina mea !"
Mihai Eminescu,Speranța,"Cum mângâie dulce, alină ușor
Speranța pe toți muritorii !
Tristeță, durere și lacrimi, amor
Azilul își află în sânu-i de dor
Și pier, cum de boare pier norii.

Precum călătoriul, prin munți rătăcind,
Prin umbra pădurii cei dese,
La slaba lumină ce-o vede lucind
Aleargă purtat ca de vînt
Din noaptea pădurii de iese:

Așa și speranța - c-un licur ușor,
Cu slaba-i lumină pălindă--
Animă-nc-o dată trermândul picior,
De uită de sarcini, de uită de nori,
Și unde o vede s-avântă.

La cel ce în carcere plânge amar
Și blastemă ceriul și soartea.
La neagra-i durere îi pune hotar,
Făcând să-i apară în negru talar
A lumii paranimfă - moartea.

Și maicii ce strînge pruncuțu-i la sân,
Privirea de lacrime plină,
Văzînd cum geniile morții se-nclin
Pe fruntea-i copilă cu spasmuri și chin,
Speranța durerea-i alină.

Căci vede surâsu-i de grație plin
Și uită pericolul mare,
L-apleacă mai dulce la sânu-i de crin
Și fața-i umbrește cu păr ebenin,
La pieptu-i îl strînge mai tare.

Așa marinarii, pe mare îmblând,
Izbiți de talazuri, furtune,
Izbiți de orcanul ghețos și urlând,
Speranța îi face de uită de vânt,
Și speră la timpuri mai bune.
Așa virtuoșii murind nu desper, 
Speranța-a lor frunte-nsenină,
Speranța cea dulce de plată în ceri,
Îi face de uită de-a morții dureri,
Pleoapele-n pace le-nchină.

Cum mângâie dulce, alină ușor
Speranța pe toți muritorii!
Tristeță, durere și lacrimi, amor
Azilul își află în sânu-i de dor
Și pier, cum de boare pier norii."
Mihai Eminescu,Misterele nopții,"Când din stele auroase
Noaptea vine-ncetișor,
Cu-a ei umbre suspinânde,
Cu-a ei silfe șopotinde,
Cu-a ei vise de amor;

Câte inimi în plăcere
Îi resaltă ușurel!
Dar pe câte dureroase
Cântu-i mistic le apasă,
Cântu-i blând, încetinel.

Două umbre, albicioase
Ca și fulgii de ninsori,
Razele din alba lună
Mi le torc, mi le-mpreună
Pentru-ntregul viitoriu,
Iar doi îngeri cântă-n plângeri,
Plâng în noapte dureros,
Și se sting ca două stele,
Care-n nuntă, ușurele,
Se cunun căzânde jos.

Într-un cuib de turturele
Ca și fluturii de-ușor
Saltă Eros nebunește,
Îl  dezmiardă, l-âncălzește
Cu un vis de tainic dor;

Iar în norul  de profume
Două suflete de flori
Le desparte-a nopții mire
Cu fantastica-i șoptire,
Le resfirâ, până mor.

Când pe stele aurie
Noaptea doarme ușuel,
Câte mime râzânde,
Dar pe câte suspinânde
Le delasă-ncetinel !

Dar așa ni e destinul
Vitreg prea adeseori.
Unui lumea-i acordează,
Iar pe altul îl botează
Cu-a lui rouă de plânsori."
Mihai Eminescu,Spre suvenire,"Dacă vreodată în lunga-ți cale,
Te-i simți, frate, nenorocit,
Pieptul în chinuri, inima-n jale,
Viața-ți de lacremi o tristă vale
Ochiu-ți în plângeri de dor răpit
Când fără soarte, fără de nume,
Te-i vedea singur... desprețuit,
Un singur suflet nu-i avea-n lume,
Luptând cu-a vieții valuri în spume,
Un suflet care te-ar fi iubit;
Când fug amicii de lângă tine;
Când plângi de Soarte-ți trist, părăsit:
Gândește-atuncea și tu la mine,
Nici eu în lume n-o duc mai bine,
Și eu sunt, frate, nenorocit."
Mihai Eminescu,Horia,"Să priveasc-Ardealul lunei i-e rușine
Că-a robit copii-i pe sub mâni streine.

Ci-ntr-un nor de abur, într-un văl de ceață,
Își ascunde tristă galbena ei față.

Horia pe-un munte falnic stă călare:
O coroană sură munților se pare,
Iar Carpații țepeni îngropați în nori
Își vuiau prin tunet gândurile lor.

- Eu am, zise-un tunet, suflet mare, greu,
Dar mai mare suflet bate-n pieptul său

Fruntea-mi este albă ca de ani o mie,
Dară a lui nume mai mult o să ție.

- Nalți suntem noi munții, zise-un vechi Carpat,
Dar el e mai mare, că ni-i împărat.

Atunci luna iese, norilor regină,
Fruntea lui cea pală roșu o-nsenină,

Galbenele-i raze încing fruntea-i rece,
Că părea din munte diadem de rege.

Și un stol de vulturi muntele-ncongior,
Cugetând că-i Joe, dumnezeul lor,

Când în miezul nopții, cununat cu nimb,
Fulgere aruncă sus de pe Olimp."
Mihai Eminescu,Frumoasă-i...,"În lacul cel verde și lin
Răsfrânge-se cerul senin,
Cu norii cei albi de argint,
Cu soarele nori sfâșâind.
Dumbrava cea verde pe mal
S-oglindă in umedul val,
O stâncă stârpită de ger
Înalț-a ei frunte spre cer.
Pe stânca sfărmată mă sui,
Gândirilor aripi le pui;
De-acolo cu ochiul uimit
Eu caut colo-n răsărit
Și caut cu sufletul dus
La cerul pierdut în apus.
Cobor apoi stânca în jos,
Mă culc între flori cu miros,
Ascult la a valului cânt,
La gemătul dulce din vânt.
Natura de jur, împrejur.
Pe sus e o boltă de-azur,
Pe jos e un verde covor,
Țesut cu mii tinere flori.
Văd apa ce tremură lin
Cum vântul o-ncruntă-n suspin
Simt zefiri cu-aripi de fiori
Muiate în miros de flori,
Văd lebede, barcă de vânt,
Prin unde din aripe dând,
Văd fluturi albaștri, ușori,
Roind si bând miere din flori.
De ce nu am aripi să zbor,
M-aș face un flutur ușor,
Un flutur ușor și gentil
Cu suflet voios de copil,
M-aș pune pe-o floare de crin
Să-i beau suflețelul din sân,
Căci am eu pe-o floare necaz,
Frumoasă-i ca ziua de azi!"
Mihai Eminescu,Lida,"Marea-i tristă-n  vântul serei.
Pe ruini ce se deșir
Lida vede-icoana mării
Și pe față-i plâng gândiri.

Blonda Lid-amor gândește.
Marea vede chipu-i pal
Și-n adâncu-i zugrăvește
Prin ruini un ideal.

Un pescar pe țărmuri trece
Și din placa de argint
Vede zâna tristă, rece
Prin risipe rătăcind.

Peste-un an în nopți de vară,
Vezi pe luciul vagabond
Cu pescaru-n luntre zboară
Al ruinei geniu blond."
Mihai Eminescu,Ondina,"L-al orelor zilei șirag râzător
Se-nșir cele negre  și mute
Ce poartă în suflet mistere de-amor
Pălite, sublime, tăcute.
Și noaptea din nori
Pe-aripi de fiori
Atinge ușoară, cu gândul,
Pământul.

Pe-un cal care soarbe prin nările-i foc,
Din ceață pustie și rece
Un june pe vânturi, cu capul în joc,
Cu clipa gândirei se-ntrece
Și calu-i turbat
Zbura necurmat
Mânat ca de-a spaimelor zână
Bătrână

Pe aripi de munte și stânci de asfalt
Castelul se nalță, se-ncruntă
Și creștetu-i negru  și creștetu-i nalt
De nauri și ani se-ncăruntă,
Dar astăzi e viu
Și-n ton auriu
Răsună din umbra cea mar
Cântare.

În mii de lumine ferestrele ard,
Prin cari se văd trecătoare
Prin tactul cântărei sublime de bard
Cum danță la umbre ușoare,
Cum danță ușor
Dulci vise de-amor.
Palatul părea în magie
Aurie.

Ca cerbul ce s-alță în creștet de stânci,
Urmat de săgeat-arzătoare,
E  calul ce sare prăpastii adânci
În zboru-i putemic și mare,
Cu nara arzând,
Cu coama pe vânt,
O dată-ncă pinten l-împunge
Și-ajunge.

Iar junele sare ușor de pe el
Sub mantă-i purtând mandolină,
Cu inima plină de-amoru-i fidel,
Cu mintea de visure plină,
De grile de fier
Al meu cavaler
S-avântă cătând pe fereastă
Și-adastă:

Ca gânduri palide din ore dalbe
Zboară danțândele ființe albe,
Par aromatele suflete line
Duse de zeifirii de grin grădine,
În coruri nimfele cântă la hore
Și gem în lirele blânde, sonore,
Ascunse gândure de dor de ducă
Triste și palide ca o nălucă,
Apoi în citere ele-ncordară
Și plin și limpede încet cântară
Glas a trecutului, ce însenină
Mintea cea turbure de gânduri plină:

Pe râul dorului, mânat de vânture,
Veni odat'
Pe-un vas cu vâslele muiate-n cânture,
Lin-âmpărat.

Venit-a regele să calce văile
Cătând o sor',
Eroi se-ninimă și plâng femeile
De-a lui amor.

El fură munților ecauri tinere,
Cântul la dor,
Răpește buzelor naivei Vinere
Vorba d-amor.

Pe munți în negură, pe stânci de cremene,
El a cătat
O albă vergină, să-i fie gemene
Și te-a aflat.

Tu ești cântărilor sororă gemene,
Sufletul lor,
Regele inimei trebuie să-ți semene
Ca vis cu dor.

In tine vede-se că e în ceriure
Un Dumnezeu,
Purtând simetria și-a ei misterure
În gândul său.

Mână dar coardele unele-ntr-altele,
Mână-le lin.
Căci ca în sufletu-ți n-a găsit altele
Regele Lin.

Cântă cu doliul, ce-i varsă belele
Când plâng de-amor,
Să creadă lumile, să creadă stelele
Că-i tactul lor.

Cum zboară îngerii din stele-n stele,
Barzii zbor, flutură printr-a lor bele;
Din lungul horelor amestecate
Barzii ridic-a lor glasuri bărbate.
Arpele-n cântece par că se sfarmă
Când gem cu sufletul, când zic de-alarmă.
Muzica sferelor: Seraphi adoară
Inima lumilor ce-o încongioară,
Dictând în cântece de fericire
Stelelor tactul lor să le inspire.
Cum din colorile ce se îmbină
Naște a soarelui albă lumină,
Astfel prin vocile răsunătoare
Curge-astă mistică, dulce cântare:

Ondină,
Cu ochi de dulce lumină,
Cu bucle ce-nvăluie-n aur
Tezaur!

Idce,
Pierdută-ntr-o palidă fce
Din planul Genezei, ce-aleargă
Ne-ntreagă!

Să-nvii vii
Și stânca de care râd timpii
Și tot ce mai e-n nesimțire
În fire ?
Vin' dară,
Căci ochiu-ți e viață și pară,
Și sufletu-ți, blândă magie
Ce-nvie.

Să cânte
Ce secoli tăcu înainte,
Și-a munților creștete nalte
Să salte.

Și din amestecul de vise dalbe,
Dentre dănțândele ființe albe,
Iese, cum cântecul dintre suspine,
Regina albelor nopții regine.
Păru-i ca aurul fața-ncadrează,
Cunună-n undele-i se furișează.
Pe-o liră gingașă și argintie
Mânuța-i coardele le-ncurcă vie
Și cum din zilele poetici, june,
A idealului iese minune,
Astfel prin notele lirei de-amor
Glasul ei tremură, dulce ușor:

Liră spartă-n stânca lume,
Suflet stins, muiat în nor.
Plâns amar luat de glume,
Adevărul vrăjitor:

E ființa-mi tremurândă
Care trece-n infinit,
Ca un fulger fără țintă,
Ca un cap fără zenit.

Și din chinuri ce mă-neacă,
Eu sorb mirul cel curat
Cum o lebădă se pleacă,
Bând din lacul înghețat.

Și cu moartea cea adâncă
Am schimbat al vieței gând.
Am fost vultur pe o stâncă,
Sunt o cruce pe-un mormânt.

Care-i scopul vieței mele,
Întreb sufletu-mpietrit?
Ochiu-i stins, buzele mele
De dureri a-nvinețit

Crucea-mi pare gânditoare,
Parca arde-a vieții-mi tort
Și prin neguri, mormântare
Privesc, fața mea de mort
Dar atunci când albe zâne
S-or privi-n sufletul meu,
A! gândiți, gândiți la mine
Că am fost în lume eu.

Un murmur fceric dezmiardă doios
A salei tăcere senină,
Prin bolta ferestrei, arcată pompos,
S-aude vibrând mandolină,
Ș-un eco ușor,
Setos de amor,
Se-neacă-ntr-a mandolei strune
Nebune.

Și toată viața lui, tot ce-a cules
Din unde, din munte, din vale,
Tot sufletu-i june, tot scumpu-i eres
Îl pierde în coardele sale.
Vărsându-l cu dor,
Plângând râzător,
Ei cântă cu buze de miere
Durere:

,,De ce nu-s o floare uscată de vânt
Și pală ca fruntea pe moarte.
Ce mila o pierde prin cruci de mormânt
Cu miros strivit, fără soarte,
C-atunci m-ai lua,
La mine-ai căta
Gândindă, cum e trecătoare
O floare.

Dar eu nu-s, copilă, decât un amor
Ce arde-n o inimă jună,
Un glas de pe buze aprinse de dor,
O mimte pustie, nebună
Și dulce descânt
Pe coarde de-argint,
Când palida mea nebunie
Învie.

Dar am o câmpie ce undoie-n flori,
Câmpia speranțelor mele.
Acolo te-asteaptă râzândele zori,
Pletindu-ți coroană de stele.
S-aduci prin amor
De viață fior,
În câmpul speranțelar vină,
Ondină !"""
Mihai Eminescu,"Ce-ți doresc eu ție, dulce românie","Ce-ți doresc eu ție, dulce Românie,
Țara mea de glorii, țara mea de dor?
Brațele nervoase, arma de tărie,
La trecutu-ți mare, mare viitor
Fiarbă vinu-n cupe, spumege pocalul,
Dacă fiii-ți mârdri aste le nutresc;
Căci rămâne stânca, deși moare valul,
Dulce Românie, asta ți-o doresc.
Vis de răzbunare negru ca mormântul
Spada ta de sânge dușman fumegând,
Și deasupra idrei fluture cu vântul
Visul tău de glorii falnic triumfând,
Spună lumii large steaguri tricoloare,
Spună ce-i poporul mare, românesc,
Când s-aprinde sacru candida-i vâlvoare,
Dulce Românie, asta ți-o doresc.

Îngerul iubirii, îngerul de pace,
Pe altarul Vestei tainic surâzând,
Ce pe Marte-n glorii să orbească-l face,
Când cu lampa-i zboară lumea luminând,
El pe sânu-ți vergin încă să coboare,
Guste fericirea raiului ceresc,
Tu îl strânge-n brațe, tu îi fă altare
Dulce Românie, asta ți-o doresc.

Ce-ți doresc eu ție, dulce Românie
Tânără mireasă, mamă cu amor !
Fiii tăi trăiască numai ân frăție
Ca a nopții stele, ca a zilei zori,
Viața în vecie, glorii, bucurie,
Arme cu tărie, suflet românesc,
Vis de vitejie, fală și mândrie,
Dulce Românie, asta ți-o doresec!"
Mihai Eminescu,La heliade,"De mi-ar permite-Apolon s-aleg dintre cunune,
Ghirlanda n-aș alege-o de flori plăpânde, june,
Ci falnica cunună a bardului bătrân;
Eu n-aș alege lira vibrândă de iubire,
Ci ccea care falnic îmi cântă de mărire,
Cu focul albei Veste aprinde al meu sân.

Ghirlanda ce se-nsoară cu silfele ușoare,
Pe fruntea inspirată, pe fruntea-nspirătoare,
De bucle-ncungiurată, blondine, undoind,
Plăcută-i a ghirlandă -- sublimă însă este
Cununa cea de laur, ce sântă se-mpletește
Pe fruntea cea umbrită de bucle de argint.

Ca visul e cântarea ce-o-ntoană Eol dulce,
Când silfele vin jalnic prin lilii să se culce,
Să doarmă somn de îngeri pe sânul alb de flori;
Sublim însă e cântul când țipă și ia-n goană
Talazurile negre ce turbă, se răstoamă,
Și spumegă ca furii și urlă-ngrozitoriu.

Astfeli îți e cântarea, bătrâne Heliade.
Cum curge profeția unei Ieremiade,
Cum se răzbun-un vifor zburând din nor în nor.
Ruga-m-aș la Erato să cânt ca Tine, barde,
De nu în viața-mi toată, dar cântecu-mi de moarte
Să fie ca ""Blăstemu""- Ți... să-l cânt, apoi să mor."
Mihai Eminescu,Nu e steluță,"Nu e steluță tremurătoare
Să nu gândească în drum de nor
La altă steauă strălucitoare,
La alt amor.

Numai o viață pe gând de moarte,
Numai o frunte ce-a-ngălbenit,
Numai un aton fără de soarte
Nu e iubit.

Galbena steauă fără lumină,
Altar să n-aibă un Dumnezeu,
Este-al meu suflet care declină,
Sufletul meu!"
Mihai Eminescu,Din lira spartă...,"Din lira spartă a mea cântare
Zboar-amorțită, un glas de vânt,
Să se oprească tânguitoare
Pe un mormânt!

Oare femeia pe care mie
Dumnezeu sântul o-a destinat
In patu-acela de cununie
S-a-nfășurat?

O caut, gându-mi și-o-nchipuiește,
Dar n-am văzut-o de când eu sunt...
Oare amorul ce îmi zâmbește
E  in mormânt?"
Mihai Eminescu,Filosofia copilei,"Glasul plăcerei dulce iubit
Cheamă gândirea pe a mea frunte,
Ce zboară tainic ca și o luntre
În oceanu-i nemărginit.

Stelele toate angeli îi par,
Angeli cu aripi strălucitoare,
A căror inimi tremurătoare
Candele d-aur nouă mi-apar.

Falnică-i pare legea Creării,
Lumi ce de focuri în lumi înot,
Candeli aprinse lui Zebaot,
Ce ard topirei și renvierei.

Dar mai putemic, mai nalt, mai dulce
Îi pare legea de a iubi,
Fără ea nu e de a trăi,
Fără ea omul ca stins se duce.

De-accea nu voi ca eu să fiu:
Pală idce-a Dumnezeirei,
Șotă copilă a nesimțirei,
Foc mort ce pare a arde viu.

Ci voi să-mi caut pe-ntinsa lume
O frunte albă să o desmierd
Și-n ea gândirea mea să o pierd,
Cum pierde-un eco pribeagul nume.
Să-ncunun capul unui iubit
Cu vise d-aur în rai țesute,
Până ce ginii necunoscute
Mi-ar rumpe lanțul d-a fi trăit."
Mihai Eminescu,La o artistă,"Ca a nopții poezie,
Cu-ntunerecul talar,
Când se-mbină, se-mlădie
C-un glas tainic, lin, amar.
Tu cântare întrupată!
De-al aplauzelor flor,
Apărând divinizată,
Răpiși sufletu-mi în dor.

Ca zefirii ce adie
Cânturi dulci ca un fior,
Când prin flori de iasomie
Își sting sufletele lor,
Astfeli notele murinde,
Blânde, palide, încet,
Zbor sub mâna-ți tremurânde,
Ca dulci gânduri de poet.

Sau ca lira sfărâmată,
Ce răsgeme-ngrozitoriu
Când o mână înghețată
Rumpe coardele-n fior,
Astfeli mâna-ți tremurândă
Bate-un cântec mort și viu.
Ca furtuna descrescândă
Care muge a pustiu.

Ești tu nota rătăcită
Din cântarea sferelor,
Ce etemă, nefinită
Îngerii o cântă-n cor?
Ești ființa-armonioasă
Ce-o gândi un serafin,
Când pe lira-i tânguioasă
Mâna cântecul divin?

Ah, ca visul ce se-mbină
Palid, lin, încetișor,
Cu o rază de lumină.
Ce-arde geana ochilor;
Tu cântare întrupată !
De-al aplauzelor flor
Dispărând divinizată,
Răpiși sufletu-mi în dor."
Mihai Eminescu,Viața mea fu ziuă,"Viata mea fu ziuă și ceru-mi un senin,
Speranța, steaua de-aur mie-mi lucea în sân
Până ce-ntr-al meu suflet dodat-ai apărut
O, îngere căzut!

Și două stele negre luciră-n nengri foc
Pe cerul vieței mele; - iar geniul-noroc
Mă lasă-n lume singur, dispare în abis
De nour și de vis.

O rază din privire-ți viața mi-a-nnegrit,
Din sânul meu speranța divină a fugit;
Norocul și-a stins steaua; de m-ai iubi măcar,
O înger de amar !

Dar nu!... Din lumea-mi neagră tu zbori în calea ta,
Sub pasul tău pe-arenă de aur vei călca,
Când eu pierdut în noapte-mi nimic nu mai sperez,
Ci vecinic te visez."
Mihai Eminescu,Numai poetul...,"Lumea toată-i trecătoare.
Oamenii se trec și mor
Ca și miile de unde;
Ce un suflet le pătrunde,
Treierând necontenit
Sânul mărei infinit.

Numai poetul,
Ca pasări ce zboară
Deasupra valurilor,
Trece peste nemărginirea timpului
În ramurile gândului,
În sfintele lunci,
Unde pasări ca el
Se-ntrec în cântări."
Mihai Eminescu,Amorul unei marmure,"Oștirile-i alungă în spaimă înghețată,
Cu sufletu-n ruină, un rege-asirian,
Cum stâncelor aruncă durerea-i înspumată
Gemândul uragan.

De ce nu sunt un rege să sfarm cu-a mea durere,
De ce nu sunt Satana, de ce nu-s Dumnezeu,
Să fac să rump-o lume ce sfâșie-n tăcere
Zdrobit sufletul meu.

Un leu pustiei rage turbarea lui fugindă,
Un ocean se-mbată pe-al vânturilor joc,
Și norii-și spun în tunet durerea lor mugindă,
Gândirile de foc.

Eu singur n-am cui spune cumplita mea durere,
Eu singur n-am cui spune nebunul meu amor,
Căci mie mi-a dat soartea amara mângâiere
O piatră să ador.

Murindului speranța, turbării răzbunarea
Profetului blestemul, credinței Dumnezeu,
La sinucid o umbră ce-i sperie desperarea,
Nimic, nimica eu.

Nimica, doar icoana-ți, care mă învenină,
Nimic, doar suvenirea surâsului tău lin,
Nimic decât o rază din fața ta senină,
Din ochiul tău senin.

Și te iubesc, copilă, cum repedea junie
Iubește-n ochi de flacări a zilelor noroc,
Iubesc precum iubește pe-o albă vijelie
Un ocean de foc.

Din ochi de-ar soarbe geniu slăbita mea privire
De-ar tremura la sânu-mi gingașul tău mijloc,
Ai pune pe-a mea frunte în vise de mărire
Un diadem de foc,

Și-aș pune soartea lumii pe buza-ți purpurie,
Aș pune lege lumii râzândul tău delir,
Aș face al tău zâmbet un secol de orgie,
Și lacrimile-ți mir.

Căci te iubesc, copilă, ca zeul nemurirea,
Ca preotul altariul, ca spaima un azil;
Ca sceptrul mâna blândă, ca vulturul mărirea,
Ca visul pe-un copil.

Și pasu-n urma-ți zboară c-o tainică mânie,
Ca un smintit ce cată cu ochiu-ngălbenit,
Cu fruntea-nvinețită, cu fața cenușie
Icoana ce-a iubit."
Mihai Eminescu,Junii corupți,"La voi cobor acuma, voi suflete-amăgite,
Și ca să vă ard fierea, o, spirite-amețite,
Blăstemul îl invoc;
Blăstemul mizantropic, cu vânăta lui gheară,
Ca să vă scriu pe frunte, ca vita ce se-nfiară
Cu fierul ars în foc.

Deși știu e-a mea liră d-a surda o să bată
În preajma minții voastre de patimi îmbătată,
De-al patimilor dor;
În preajma minții voastre ucisă de orgie,
Și putredă de spasmuri, și arsă de beție,
Și seacă de amor.

O fiarbă-vă mânia în vinele stocite,
În ochii stinși de moarte, pe frunți învinețite
De sânge putrezit;
Că-n veci nu se va teme Profetul vreodată
De brațele slăbite, puterea leșinată
A junelui cănit.

Ce am de-alege oare în seaca-vă ființă?
Ce foc făr-a se stinge, ce drept făr' să nu mință,
O, oameni morți  de vii !
Să vă admir curagiul în vinure vărsatc,
În sticle sfărâmate, hurii nerușinate
Ce chiuie-n orgit?

Vă văd lungiți pe patul juneții ce-ați spurcat-o,
Suflând din gură boala vieții ce-ați urmat-o,
Și arși pân-în rărunchi;
Sau bestiilor cari pe azi îl țin în fiară,
Cum lingușiți privirea cea stearpă și amară,
Cum cădeți în genunchi !

Sculați-vă!... căci anii trecutului se-nșiră,
În șiruri triumfale stindardul îl resfiră,
Căci Roma a-nviat;
Din nou prin glorii calcă, cu fața înzeită,
Cu faclele nestinse, puterea-i împietrită,
Poporul împărat.

Sculați-vă!... căci tromba de moarte, purtătoare
Cu glasul ei lugubru răcnește la popoare
Ca leul spăriat;
Tot ce respiră-i liber, a tuturor e lumea,
Dreptatea, libertatea nu sunt numai un nume,
Ci-aievea s-au serbat,

Încingeți-vă spada la danțul cel de moarte,
Aci vă poarte vântul, cum știe să vă poarte
A țopăi în joc!
Aci vă duceți valuri în mit batalioane,
Cum în păduri aprinse, mânat de uragane,
Diluviul de foc.

Vedeți cum urna creapă, cenușa reînvie,
Cum murmură trecutul cu glas de bătălie
Poporului roman;
Cum umbrele se-mbracă în zale ferecate.
Și frunțile cărunte le nalță de departe
Un Cesar, un Traian.
Cad putredele tronuri în marea de urgie,
Se sfarmă deodată cu lanțul de sclavie
Și sceptrele de fier;
În două părți infernal portalele-și deschide,
Spre-a încăpea cu mia răsufletele hâde
Tiranilor ce pier!

În darn răsună voacea-mi de eco repețită,
Vă zguduie arama urechea amorțită
Și simțul leșinat
Virtutea despletită și patria-ne zeie
Nu pot ca să aprinză o singură scânteie
În sufletu-nghețat.

Și singur stau și caut, ca uliul care cată
În inima junimii de viața-i dezbrăcată
Un stârv spre-a-l sfâșia;
Ca pasărea de zboru-i din ceriuri dizmețită,
Ca muntele ce-n frunte-i de nouri încrețită
Un trăsnet ar purta.

Dar cel puțin nu spuneți că aveți simțiminte,
Că-n veci nu se îmbracă în veștede vesminte
Misteriul cel sânt;
Căci vorba voastră sună ca plâns la cununie,
Ca cobea ce îngână un cânt de veselie,
Ca râsul la mormânt."
Mihai Eminescu,La moartea principelui Știrbey,"Turnurile mișcă-n doliu a lor inimi de aramă
Și un înger cu-aripi negre, cu diademă de spini,
Cu cântarea-i plângătoare lumea mișcă, lumea cheamă,
Precum mișcă vântu-n cântec fața mării de senin:

Și cu ochiul plin de lacrimi națiunea cea română,
Care are-n mii de inimi sufletul ei tremurând,
Vede cum prin nori se stinge stea cu flacără divină
Și aude-n cer un tunet și un gemet pe pământ...

A-ntristării neagră-aripă peste lume se întinde,
Totul tace, căci durerea este mută ca un gând,
Lumea azi nimic nu vede, ochiu-i nimic nu cuprinde,
Decât curse-acelui astru ce se sparge p-un mormânt

Cine-i acvila ce cade? Cine-i stânca ce se sfarmă?
Cine-i leul ce închide cu durere ochii săi?
Cine-i tunetul ce moare umplând lumea de alarmă?...
- Este domnul României: Barbu Dimitrie Știrbey!..."
Mihai Eminescu,De-aș muri ori de-ai muri,"C-o bucurie tristă te țin acum în brațe.
Privire în privire și sân la sân trăim,
Și gura ta-mi surâde, și ochii tăi mă-nvață
Când ținem fericirea pe sân cum s-o iubim.

Dar de-oi muri vreodată, copilă gânditoare,
Crezi c-o să-ncet din stele mai mult a te iubi
Ș-o să petrec în pace prin lumile de soare,
În care-oi dăinui ?

Nu, nu, copilă scumpă!... De-i auzi în noapte,
Când vei veghea în rugă la candela de-argint,
De-i auzi cum tristă aripa unei șoapte
Te-atinge aiurind,

De-i auzi vreo arpă sfărmată, plângătoare,
Vuind ca jalea neagră ce geme prin ruini,
Să știi că prin a nopții de întuneric mare,
La tine, înger, vin !

Și să-mi deschizi fereastra, să trec o boare sântă
Prin oalele uitate de veștejite flori,
Să mângâi cu suflarea-mi a ta față pălindă,
Ochii tăi gânditori.

Dar de-i muri tu, înger de palidă lumină,
O, ce m-aș face-atuncea, mărite Dumnezeu?
O să te plâng cu vântul ce fluieră-n ruină
În rece zborul său?

Înger venit din ceriuri, oi plânge al tău nume,
L-oi sămăna-n flori palizi și-n stelele de foc,
Cânta-te-aș ca și râul cel scuturat de spume
În nopți ce stau pe loc.

Și aș primbla durerea-mi pe mări necunoscute,
Prin stânci ce stau în aer, prin munți cu cap de fier,
Prin selbele bătrîne și prin pustii tăcute
Prin nourii din ceriu.

Pân' ce bătrân și palid, cu cap pleșuv ca stânca,
Aș rumpe de pe liră-mi coarde ce nu mai sun'
Și aș culca în piatră inima mea adâncă,
Cu dorul ei nebun."
