autor,titlu,text
Mihai Eminescu,Strigoii,"... că trece aceasta ca fumul de pre pământ.
Ca floarea au înflorit, ca iarba s-au tăiat,
cu pânză se înfășură, cu pământ se acopere.

Sub bolta cea înaltă a unei vechi biserici,
Între făclii de ceară, arzând în sfeșnici mari,
E-ntinsă-n haine albe, cu fața spre altar,
Logodnica lui Arald, stăpân peste avari;
Încet, adânc răsună cântările de clerici.

Pe pieptul moartei luce de pietre scumpe salbă
Și păru-i de-aur curge din raclă la pământ,
Căzuți în cap sunt ochii. C-un zâmbet trist și sfânt
Pe buzele-i lipite, ce vinele îi sunt,
Iar fața ei frumoasă ca varul este albă.

Și lângă ea-n genunche e Arald, mândrul rege,
Scânteie desperarea în ochii crunți de sânge,
Și încâlcit e părul lui negru... gura-și strânge;
El ar răcni ca leii, dar vai! nu poate plânge.
De zile trei își spune povestea vieții-ntrege.

""Eram un copilandru. Din codri vechi de brad
Flămânzii ochi rotindu-i, eu mistuiam pământul,
Eu răzvrăteam imperii, popoarele cu gândul...
Visând că toată lumea îmi asculta cuvântul,
În valurile Volgăi cercam cu spada vad.

Domnind semeț și tânăr pe roinicele stoluri,
Căror a mea ființă un semizeu părea,
Simțeam că universul la pasu-mi tresărea,
Și nații călătoare, împinse de a mea,
Umplut-au sperioase pustiul pân' la poluri.

Căci Odin părăsise de gheață nalta-i domă,
Pe zodii sângeroase porneau a lui popoară;
Cu creștetele albe, preoți cu pleata rară
Trezeau din codrii vecinici, din pace seculară,
Mii roiuri vorbitoare, curgând spre vechea Romă.

Pe Nistru tăbărâsem poporul tău să-mpil;
Cu sfetnici vechi de zile mă-ntâmpinași în cale,
Ca marmura de albă, cu păr de aur moale;
În jos plecat-am ochii-naintea feței tale,
Stătând un îndărătnic... un sfiicios copil.

La blânda ta mustrare simt glasul cum îmi seacă...
Eu caut a răspunde, nu știu ce să răspund;
Mi-ar fi părut mai bine-n pământ să mă cufund,
Cu mânele-amândouă eu fața îmi ascund
Și-ntâia dată-n viață un plâns amar mă-neacă.

Zâmbiră între dânșii bătrânii tăi prieteni
Și singuri ne lăsară... Te-ntreb într-un târziu,
Uitându-mă la tine, privind fără să știu:
La ce-ai venit, regină, aicea în pustiu?
Ce cauți la barbarul sub streașina-i de cetini?

Cu glasul plin de lacrimi, de-nduioșare cald,
Privindu-mă cu ochii, în care-aveai un cer,
Mi-ai zis: ""Aștept din parte-ți, o, rege cavaler,
Că-mi vei da prins pe-acela ce umilit ți-l cer...
Eu vreau să-mi dai copilul zburdalnic - pe Arald.""

Și, întorcându-mi fața, eu spada ți-am întins.
Pe plaiuri dunărene poporu-și opri mersul,
Arald, copilul rege, uitat-a Universul.
Urechea-i fu menită ca să-ți asculte viersul,
De-atunci, învingătoareo, iubit-ai pe învins.

De-atunci, fecioară blondă ca spicul cel de grâu,
Veneai la mine noaptea ca nimeni să te vadă
Și-nlănțuindu-mi gâtul cu brațe de zăpadă,
Îmi întindeai o gură deschisă pentru sfadă:
""Eu vin la tine, rege, să cer pe-Arald al meu.""

De-ai fi cerut pământul cu Roma lui antică,
Coroanele ce regii pe frunte le așază
Și stelele ce vecinic pe ceruri colindează,
Cu toate la picioare-ți eu le puneam în vază,
Dar nu-l mai vrei pe Arald, căci nu mai vrei nimică.

Ah! unde-i vremea ceea când eu cercam un vad
Să ies la lumea largă... și fost-ar fi mai bine
Ca niciodată-n viață să nu te văd pe tine -
Să fumege nainte-mi orașele-n ruine,
Să se-mplinească visu-mi din codrii cei de brad!""

Făcliile ridică - se mișc-în line pasuri,
Ducând la groapă trupul reginei dunărene,
Monahi, cunoscătorii vieții pământene,
Cu barbele lor albe, cu ochii stinși sub gene,
Preoți bătrâni ca iarna, cu gângavele glasuri.

O duc cântând prin tainiți și pe sub negre bolți,
A misticei religii întunecoase cete,
Pe funii lungi coboară sicriul sub părete,
Pe piatra prăvălită pun crucea drept pecete
Sub candela ce arde în umbra unui colț.

În numele sfântului
Taci, s-auzi cum latră
Cățelul pământului
Sub crucea de piatră.

Arald pe un cal negru zbura, și dealuri, vale
În juru-i fug ca visuri - prin nouri joacă lună -
La pieptu-i manta neagră în falduri și-o adună,
Movili de frunze-n drumu-i le spulberă de sună,
Iar steaua cea polară i-arată a lui cale.

Ajuns-a el la poala de codru-n munții vechi,
Isvoară vii murmură și saltă de sub piatră,
Colo cenușa sură în părăsita vatră,
În codri-adânci cățelul pământului tot latră,
Lătrat cu glas de zimbru răsună în urechi.

Pe-un jilț tăiat în stâncă stă țapăn, palid, drept,
Cu cârja lui în mână, preotul cel păgân;
De-un veac el șede astfel - de moarte-uitat, bătrân,
În plete-i crește mușchiul, și mușchi pe a lui sân,
Barba-n pământ i-ajunge și genele la piept...

Așa fel zi și noapte de veacuri el stă orb,
Picioarele lui vechie cu piatra-mpreunate,
El numără în gându-i zile nenumărate,
Și fâlfâie deasupra-i, gonindu-se în roate,
Cu-aripile-ostenite un alb ș-un negru corb.

Arald atunci coboară de pe-a lui cal. C-o mână
El scutură din visu-i moșneagu-ncremenit:
- ""O, mag, de zile vecinic, la tine am venit,
Dă-mi înapoi pe-aceea ce moartea mi-a răpit,
Și de-astăzi a mea viață la zeii tăi se-nchină.""

Bătrânul cu-a lui cârjă sus genele-și ridică,
Se uită lung la dânsul, dar gura-nchisă-i tace;
Cu greu a lui picioare din piatră le desface,
Din tronu-i se coboară, cu mâna semn îi face
Ca-n sus să îl urmeze pe-a codrilor potică.

În poarta prăbușită ce duce-n fund de munte,
Cu cârja lui cea vechie el bate de trei ori,
Cu zgomot sare poarta din vechii ei ușori,
Bătrânul se închină... pe rege-l prind fiori,
Un stol de gânduri aspre trecu peste-a lui frunte.

În dom de marmur negru ei intră liniștiți
Și porțile în urmă în vechi țâțâni s-aruncă.
O candelă bătrânul aprinde - para lungă
Se nalță-n sus albastră, de flacăre o dungă,
Lucesc în juru-i ziduri ca tuciul lustruiți.

Și în tăcere crudă ei nu știu ce aștept...
Cu mâna-ntinsă magul îi face semn să șadă,
Arald cu moartea-n suflet, a gândurilor pradă,
Pe jeț tăcut se lasă, cu dreapta pe-a lui spadă,
În zid de marmur negru se uită crunt și drept.

Fantastic pare-a crește bătrânul alb și blând;
În aer își ridică a farmecelor vargă
Și o suflare rece prin dom atunci aleargă
Și mii de glasuri slabe înce sub bolta largă
Un cânt frumos și dulce - adormitor sunând.

Din ce în ce cântarea în valuri ea tot crește,
Se pare că furtuna ridică al ei glas,
Că vântul trece-n spaimă pe-al mărilor talaz,
Că-n sufletu-i pământul se zbate cu necaz -
Că orice-i viu în lume acum încremenește.

Se zguduie tot domul, de pare-a fi de scânduri,
Și stânci în temelie clătindu-se vedem,
Plânsori sfâșietoare împinse de blestem,
Se urmăresc prin bolte, se cheamă, fulger, gem
Și cresc tumultuoase în valuri, rânduri, rânduri...

- ""Din inimă-i pământul la morți să deie viață,
În ochii-i să se scurgă scântei din steaua lină,
A părului lucire s-o deie luna plină,
Iar duh dă-i tu, Zamolxe, sămânță de lumină,
Din duhul gurii tale ce arde și îngheață.

Stihii a lumei patru, supuse lui Arald,
Străbateți voi pământul și a lui măruntaie,
Faceți din piatră aur și din îngheț văpaie,
Să-nchege apa-n sânge, din pietre foc să saie,
Dar inima-i fecioară hrăniți cu sânge cald.""

Atuncea dinaintea lui Arald zidul piere;
El vede toată firea amestecat-afară -
Ninsoare, fulger, gheață, vânt arzător de vară -
Departe vede-orașul pe sub arc de pară,
Și lumea nebunise gemând din răsputere;

Biserica creștină, a ei catapeteasmă
De-un fulger drept în două e ruptă și tresare;
Din tainiță mormântul atuncea îi apare,
Și piatra de pe groapă crăpând în două sare;
Încet plutind se-nalță mireasa-i, o fantasmă...

O dulce întrupare de-omăt. Pe pieptu-i salbă
De pietre scumpe... părul i-ajunge la călcâie,
Ochii căzuți în capu-i și buze viorie;
Cu mânele-i de ceară ea tâmpla și-o mângâie -
Dar fața ei frumoasă ca varul este albă.

Prin vânt, prin neguri vine - și nourii s-aștern
Fug fulgerele-n lături, lăsând-o ca să treacă,
Și luna înnegrește și ceru-ncet se pleacă
Și apele cu spaimă fug în pământ și seacă -
Părea că-n somn un înger ar trece prin infern.

Priveliștea se stinge. în negrul zid s-arată,
Venind ca-n somn lunatic, în pasuri line, ea;
Arald nebun se uită - cu ochii o-nghițea,
Puternicele brațe spre dânsa întindea
Și-n nesimțire cade pe-a jilțului său spată.

Își simte gâtu-atuncea cuprins de brațe reci,
Pe pieptul gol el simte un lung sărut de gheață,
Părea un junghi că-i curmă suflare și viață...
Din ce în ce mai vie o simte-n a lui brațe
Și știe că de-acuma a lui rămâne-n veci.

Și sufletul ei dulce din ce în ce-i mai cald...
Pe ea o ține-acuma, ce fu a morții pradă?
Ea-nlănțuiește gâtu-i cu brațe de zăpadă,
Întinde a ei gură, deschisă pentru sfadă:
- ""Rege,-a venit Maria și-ți cere pe Arald!""

- ""Arald, nu vrei tu fruntea pe sânul meu s-o culci?
Tu zeu cu ochii negri... o, ce frumoși ochi ai!
Las' să-ți înlănțui gâtul cu părul meu bălai,
Viața, tinerețea mi-ai prefăcut-o-n rai,
Las' să mă uit în ochii-ți ucizător de dulci.""

Și blânde, triste glasuri din vuiet se desfac,
Acușa la ureche-i un cântec vechi străbate,
Ca murmur de izvoare prin frunzele uscate,
Acuș o armonie de-amor și voluptate
Ca molcoma cadență a undelor pe lac.

""... cum de multe ori când mori oamenii,
mulți deîntr-acei morți zic se scoală de
se fac strigoi...""
Îndereptarea legii, 1652

În salele pustie lumine roși de torții
Rănesc întunecimea ca pete de jeratic;
Arald se primblă singur, râzând, vorbind sălbatic
Arald, tânărul rege, e-un rege singuratic -
Palatu-i parc-așteaptă în veci să-i vie morții.

Pe-oglinzi de marmuri negre un negru nimitez,
A faclelor lucire răzbind prin pânza fină
Răsfrâng o dureroasă lumină din lumină;
Zidirea cea pustie de jale pare plină
Și chipul morții pare că-n orice colț îl vezi.

De când căzu un trăsnet în dom... de-atunci în somn
Ca plumbul surd și rece el doarme ziua toată,
Pe inimă-i de-atuncea s-a pus o neagră pată -
Dar noaptea se trezește și ține judecată
Și-n negru-mbracă toate al nopții palid domn.

Un obrăzar de ceară părea că poartă el,
Atât de albă fața-i ș-atât de nemișcată,
Dar ochii-i ard în friguri și buza-i sângerată,
Pe inima sa poartă de-atunci o neagră pată,
Iară pe frunte poartă coroană de oțel.

De-atunci în haina morții el și-a-mbrăcat viața,
Îi plac adânce cânturi, ca glasuri de furtună;
Ades călare pleacă în mândre nopți cu lună,
Și când se-ntoarce, ochii lucesc de voie bună,
Pân' ce-un fior de moarte îl prinde dimineața.

Arald, ce însemnează pe tine negrul port
Și fața ta cea albă ca ceara, neschimbată?
Ce ai, de când pe sânu-ți tu porți o neagră pată,
De-ți plac făclii de moarte, cântare-ntunecată?
Arald! de nu mă-nșală privirea, tu ești mort!

Și azi el se avântă pe calul său arab,
Și drumul, ca săgeții, îi dă peste pustie,
Care sub luna plină lucește argintie -
El vede de departe pe mândra lui Marie,
Și vântu-n codri sună cu glas duios și slab.

În părul ei de aur, rubine-nflăcărate,
Și-n ochii ei s-adună lumina sfintei mări -
S-ajung curând în cale, s-alătură călări,
Și unul înspre altul se pleacă-n desmierdări -
Dar buzele ei roșii păreau că-s sângerate.

Ei trec ca vijelia cu aripi fără număr,
Căci caii lor aleargă alăturea-nspumați,
Vorbind de-a lor iubire - iubire fără saț -
Ea se lăsase dulce și greu pe a lui braț
Și-și răzimase capul bălai de a lui umăr.

- ""Arald, nu vrei pe sânu-mi tu fruntea ta s-o culci?
Tu zeu cu ochii negri... O! ce frumoși ochi ai...
Las' să-ți înlănțui gâtul cu părul meu bălai...
Viața, tinerețea mi-ai prefăcut-o-n rai -
Las' să mă uit în ochii-ți ucizători de dulci!""

Miroase-adormitoare văzduhul îl îngreun,
Căci vântul adunat-a de flori de tei troiene,
Și le așterne-n cale reginei dunărene. -
Prin frunze aiurează șoptirile-i alene.
Când gurile-nsetate în sărutări se-mpreun.

Cum ei mergând ca vântul se ceartă și se-ntreabă,
Nu văd în fundul nopții o umbră de roșeață,
Dar simt că-n a lor suflet trecu fior de gheață,
De-a morții gălbeneală pieriți ei sunt la față...
Ei simt c-a lor vorbire-i mai slabă, tot mai slabă.

- ""Arald! strigă crăiasa - las' fața să-mi ascund,
N-auzi tu de departe cucoșul răgușit?
O zare de lumină s-arată-n răsărit,
Viața trecătoare din pieptu-mi a rănit...
A zilei raze roșii în inimă-mi pătrund.""

Arald încremenise pe calu-i - un stejar,
Păinjenit e ochiu-i de-al morții glas etern,
Fug caii duși de spaimă și vântului s-aștern,
Ca umbre străvezie ieșite din infern
Ei zboară... Vântul geme prin codri cu amar.

Ei zboar-o vijelie, trec ape făr' de vad,
Naintea lor se nalță puternic vechii munți,
Ei trec în răpejune prin râuri fără punți,
Coroanele în fugă le fulgeră pe frunți,
Naintea lor se mișcă pădurile de brad.

Din tronul lui de piatră bătrânul preot vede
Și-n vânturi el ridică adâncul glas de-aramă,
Pe soare să-l oprească el noaptea o recheamă,
Furtunelor dă zborul, pământul de-l distramă...
Târziu! căci faptul zilei în slavă se răpede!

Pornește vijelia adâncu-i cânt de jale,
Când ei soseau alături pe cai încremeniți,
Cu genele lăsate pe ochi păinjeniți -
Frumoși erau și astfel de moarte logodiți -
Și-n două laturi templul deschise-a lui portale.

Călări ei intră-nuntru și porțile recad;
Pe veci pieriră-n noaptea mărețului mormânt.
În sunete din urmă pătrunde-n fire cânt,
Jelind-o pe crăiasa cu chip frumos și sfânt,
Pe-Arald, copilul rege al codrilor de brad.

Bătrânu-și pleacă geana și iar rămâne orb,
Picioarele lui vechie cu piatra se-mpreună,
El numără în gându-i și anii îi adună,
Ca o poveste-uitată Arald în minte-i sună,
Și peste capu-i zboară un alb ș-un negru corb.

Pe jilțul lui de piatră înțepenește drept
Cu cârja lui cea veche preotul cel păgân,
Și veacuri înainte el șede-uitat, bătrân,
În plete-i crește mușchiul și mușchi pe a lui sân,
Barba-n pământ i-ajunge și genele în piept."
Mihai Eminescu,Satira I,"Când cu gene ostenite sara suflu-n lumânare,
Doar ceasornicul urmează lung-a timpului cărare,
Căci perdelele-ntr-o parte când le dai, și în odaie
Luna varsă peste toate voluptoasa ei văpaie,
Ea din noaptea amintirii o vecie-ntreagă scoate
De dureri, pe care însă le simțim ca-n vis pe toate.

Lună tu, stăpân-a mării, pe a lumii boltă luneci
Și gândirilor dând viață, suferințele întuneci;
Mii pustiuri scânteiază sub lumina ta fecioară,
Și câți codri-ascund în umbră strălucire de isvoară!
Peste câte mii de valuri stăpânirea ta străbate,
Când plutești pe mișcătoarea mărilor singurătate!
Câte țărmuri înflorite, ce palate și cetăți,
Străbătute de-al tău farmec ție singură-ți arăți!
Și în câte mii de case lin pătruns-ai prin ferești,
Câte frunți pline de gânduri, gânditoare le privești!
Vezi pe-un rege ce-mpânzește globu-n planuri pe un veac,
Când la ziua cea de mâne abia cuget-un sărac...
Deși trepte osebite le-au ieșit din urna sorții
Deopotrivă-i stăpânește raza ta și geniul morții;
La același șir de patimi deopotrivă fiind robi,
Fie slabi, fie puternici, fie genii ori neghiobi!
Unul caută-n oglindă de-și buclează al său păr,
Altul caută în lume și în vreme adevăr,
De pe galbenele file el adună mii de coji,
A lor nume trecătoare le însamnă pe răboj;
Iară altu-mparte lumea de pe scândura tărăbii,
Socotind cât aur marea poartă-n negrele-i corăbii.
Iar colo bătrânul dascăl, cu-a lui haină roasă-n coate,
Într-un calcul fără capăt tot socoate și socoate
Și de frig la piept și-ncheie tremurând halatul vechi,
Își înfundă gâtu-n guler și bumbacul în urechi;
Uscățiv așa cum este, gârbovit și de nimic,
Universul fără margini e în degetul lui mic,
Căci sub frunte-i viitorul și trecutul se încheagă,
Noaptea-adânc-a veciniciei el în șiruri o dezleagă;
Precum Atlas în vechime sprijinea ceriul pe umăr
Așa el sprijină lumea și vecia într-un număr.

Pe când luna strălucește peste-a tomurilor bracuri,
Într-o clipă-l poartă gândul îndărăt cu mii de veacuri,
La-nceput, pe când ființă nu era, nici neființă,
Pe când totul era lipsă de viață și voință,
Când nu s-ascundea nimica, deși tot era ascuns...
Când pătruns de sine însuși odihnea cel nepătruns.
Fu prăpastie? genune? Fu noian întins de apă?
N-a fost lume pricepută și nici minte s-o priceapă,
Căci era un întuneric ca o mare făr-o rază,
Dar nici de văzut nu fuse și nici ochiu care s-o vază.
Umbra celor nefăcute nu-ncepuse-a se desface,
Și în sine împăcată stăpânea eterna pace!...
Dar deodat-un punct se mișcă... cel întâi și singur. Iată-l
Cum din chaos face mumă, iară el devine Tatăl...
Punctu-acela de mișcare, mult mai slab ca boaba spumii,
E stăpânul fără margini peste marginile lumii...
De-atunci negura eternă se desface în fășii,
De atunci răsare lumea, lună, soare și stihii...
De atunci și până astăzi colonii de lumi pierdute
Vin din sure văi de chaos pe cărări necunoscute
Și în roiuri luminoase isvorând din infinit,
Sunt atrase în viață de un dor nemărginit.
Iar în lumea asta mare, noi copii ai lumii mici,
Facem pe pământul nostru mușunoaie de furnici;
Microscopice popoare, regi, oșteni și învățați
Ne succedem generații și ne credem minunați;
Muști de-o zi pe-o lume mică de se măsură cu cotul,
În acea nemărginire ne-nvârtim uitând cu totul
Cum că lumea asta-ntreagă e o clipă suspendată,
Că-ndărătu-i și-nainte-i întuneric se arată.
Precum pulberea se joacă în imperiul unei raze,
Mii de fire viorie ce cu raza încetează,
Astfel, într-a veciniciei noapte pururea adâncă,
Avem clipa, avem raza, care tot mai ține încă...
Cum s-o stinge, totul piere, ca o umbră-n întuneric,
Căci e vis al neființii universul cel himeric...

În prezent cugetătorul nu-și oprește a sa minte,
Ci-ntr-o clipă gându-l duce mii de veacuri înainte;
Soarele, ce azi e mândru, el îl vede trist și roș
Cum se-nchide ca o rană printre nori întunecoși,
Cum planeții toți îngheață și s-azvârl rebeli în spaț
Ei, din frânele luminii și a soarelui scăpați;
Iar catapeteasma lumii în adânc s-au înnegrit,
Ca și frunzele de toamnă toate stelele-au pierit;
Timpul mort și-ntinde trupul și devine vecinicie,
Căci nimic nu se întâmplă în întinderea pustie,
Și în noaptea neființii totul cade, totul tace,
Căci în sine împăcată reîncep-eterna pace...

Începând la talpa însăși a mulțimii omenești
Și suind în susul scării pân' la frunțile crăiești,
De a vieții lor enigmă îi vedem pe toți munciți,
Făr-a ști să spunem care ar fi mai nenorociți...
Unul e în toți, tot astfel precum una e în toate,
De asupra tuturora se ridică cine poate,
Pe când alții stând în umbră și cu inima smerită
Neștiuți se pierd în taină ca și spuma nezărită -
Ce-o să-i pese soartei oarbe ce vor ei sau ce gândesc?...
Ca și vântu-n valuri trece peste traiul omenesc.

Fericească-l scriitorii, toată lumea recunoască-l...
Ce-o să aibă din acestea pentru el, bătrânul dascăl?
Nemurire, se va zice. Este drept că viața-ntreagă,
Ca și iedera de-un arbor, de-o idee i se leagă.
""De-oi muri - își zice-n sine - al meu nume o să-l poarte
Secolii din gură-n gură și l-or duce mai departe,
De a pururi, pretutindeni, în ungherul unor crieri
Și-or găsi, cu al meu nume, adăpost a mele scrieri!""
O, sărmane! ții tu minte câte-n lume-ai auzit,
Ce-ți trecu pe dinainte, câte singur ai vorbit?
Prea puțin. De ici, de colo de imagine-o fășie,
Vre o umbră de gândire, ori un petec de hârtie;
Și când propria ta viață singur n-o știi pe de rost,
O să-și bată alții capul s-o pătrunză cum a fost?
Poate vreun pedant cu ochii cei verzui, peste un veac,
Pintre tomuri brăcuite așezat și el, un brac,
Aticismul limbii tale o să-l pună la cântari,
Colbul ridicat din carte-ți l-o sufla din ochelari
Și te-o strânge-n două șiruri, așezându-te la coadă,
În vro notă prizărită sub o pagină neroadă.

Poți zidi o lume-ntreagă, poți s-o sfarămi... orice-ai spune,
Peste toate o lopată de țărână se depune.
Mâna care-au dorit sceptrul universului și gânduri
Ce-au cuprins tot universul încap bine-n patru scânduri...
Or să vie pe-a ta urmă în convoi de-nmormântare,
Splendid ca o ironie cu priviri nepăsătoare...
Iar deasupra tuturora va vorbi vrun mititel,
Nu slăvindu-te pe tine... lustruindu-se pe el
Sub a numelui tău umbră. Iată tot ce te așteaptă.
Ba să vezi... posteritatea este încă și mai dreaptă.
Neputând să te ajungă, crezi c-or vrea să te admire?
Ei vor aplauda desigur biografia subțire
Care s-o-ncerca s-arate că n-ai fost vreun lucru mare,
C-ai fost om cum sunt și dânșii... Măgulit e fiecare
Că n-ai fost mai mult ca dânsul. Și prostatecele nări
Și le umflă orișicine în savante adunări
Când de tine se vorbește. S-a-nțeles de mai nainte
C-o ironică grimasă să te laude-n cuvinte.
Astfel încăput pe mâna a oricărui, te va drege,
Rele-or zice că sunt toate câte nu vor înțelege...
Dar afară de acestea, vor căta vieții tale
Să-i găsească pete multe, răutăți și mici scandale -
Astea toate te apropie de dânșii... Nu lumina
Ce în lume-ai revărsat-o, ci păcatele și vina,
Oboseala, slăbiciunea, toate relele ce sunt
Într-un mod fatal legate de o mână de pământ;
Toate micile mizerii unui suflet chinuit
Mult mai mult îi vor atrage decât tot ce ai gândit.

Între ziduri, printre arbori ce se scutură de floare,
Cum revarsă luna plină liniștita ei splendoare!
Și din noaptea amintirii mii de doruri ea ne scoate;
Amorțită li-i durerea, le simțim ca-n vis pe toate,
Căci în propria-ne lume ea deschide poarta-ntrării
Și ridică mii de umbre după stinsul lumânării...
Mii pustiuri scânteiază sub lumina ta, fecioară,
Și câți codri-ascund în umbră strălucire de isvoară!
Peste câte mii de valuri stăpânirea ta străbate,
Când plutești pe mișcătoarea mărilor singurătate,
Și pe toți ce-n astă lume sunt supuși puterii sorții
Deopotrivă-i stăpânește raza ta și geniul morții!"
